Fechar os olhos,"Deve-se celebrar a resposta institucional dada ao episódio, como uma reação à aceitação social e à impunidade de condutas contrárias à ética e à legislação Mas não se deve fechar os olhos ao fato de que o chamado “Mensalão” não constituiu um evento isolado na vida nacional, quer do ponto de vista quantitativo (isto é, dos valores envolvidos) quer do ponto de vista qualitativo (da posição hierárquica das pessoas envolvidas) Justamente ao contrário, ele se insere em uma 3 Documento assinado digitalmente conforme MP n° 2"
Fechar os olhos,"O SENHOR SAINT-CLAIR DINIZ MARTINS SOUTO (PROCURADOR DO ESTADO DO RIO DE JANEIRO) - Este foi um dado do senso escolar 2012: no Estado do Rio de Janeiro, 3,5% dos professores eram contratados sob o regime temporárioO SENHOR MINISTRO LUIZ FUX (RELATOR) - Senhor Presidente, nós estamos em um ano um pouco mais atípico, digamos assim, não podemos fechar os olhos para a realidade E aí, até que se possa realizar um concurso e prover todos esses cargos, eu tenho a impressão de que vinte e quatro meses seria razoável"
Fechar os olhos,"]XV - o subsídio e os vencimentos dos ocupantes de cargos e empregos públicos são irredutíveis, ressalvado o disposto nos incisos XI e XIV deste artigo e nos arts 39, § 4º, 150, II, 153, III, e 153, § 2º, I;[…]É preocupante a situação, e o Judiciário, especialmente o Supremo, como guarda maior da Constituição Federal, a ela não deve e, mais do que isso, não pode fechar os olhos Tarda a conclusão do julgamento, pelo Plenário, do Recurso Extraordinário nº 565"
Fechar os olhos," No segundo, há crimes praticados em concurso de agentes, como é, data venia, a situação dos autos, na minha compreensão Não quero, em absoluto, fechar os olhos ao fato – destacado, inclusive, pelo eminente Relator - de que agentes podem se associar, originariamente, para fins lícitos e, em um dado momento, alterar a finalidade inicial da sua associação, dirigindo-a à prática reiterada de crimes Ainda, uma associação de pessoas pode ocorrer por finalidades várias, dentre elas a de cometer crimes, o que também configura o crime, agora denominado de associação criminosa"
Fechar os olhos," Voto - MIN MARCO AURÉLIO Supremo Tribunal Federal Inteiro Teor do Acórdão - Página 19 de 24 RE 554951 / SP acórdão impugnado por meio do extraordinário – não estou fechando os olhos ao instituto do prequestionamento Foi criada taxa e, como ressaltado pelo relator, o Tribunal de origem não se limitou a colar a pecha de inconstitucionalidade mediante a atuação – repito – de órgão fracionado ao fator indicado no artigo 6º, que é a consideração, entre outros elementos, para ter-se as tabelas do anexo – que revelam valores e, portanto, quantitativos em pecúnia –, do número de empregados"
Fechar os olhos," Não acredito em prazo sem sanção, sem consequência concretaHá mais, Presidente, e não podemos fechar os olhos sob pena de desaparecimento do instituto, ou seja, o excesso de prazo O paciente está preso – não sei a data exata do fenômeno, se não teria feito o cálculo para chegar aos meses e dias –, ante o flagrante, há mais de cinco anos"
Fechar os olhos," A implementação das adaptações, eliminações e supressões de barreiras arquitetônicas referidas no caput deste artigo deverá ser iniciada a partir do primeiro ano de vigência desta Lei (…) Examinando a legislação acima, não há como fechar os olhos ao fato de que é mesmo da competência/obrigação do ESTADO DE MINAS GERAIS proporcionar o livre acesso das pessoas portadoras de deficiência, em edifícios públicos, no caso específico, na Escola Estadual Dona Alexandra Pedreiro, no Município de Uberlândia (…) a própria lei estabelece prazo para que o início das obras de adaptações seja implementado pela Administração Pública direta ou indireta” (grifos nossos)"
Fechar os olhos," Desse modo, essas modificações que foram deflagradas pela excepcional petição da Clínica de Direitos Fundamentais da UERJ, endossada pelo PSOL e endossada pelo Ministro Marco Aurélio, tem esse papel de um diálogo com a sociedade para ela participar deste debate coletivo sobre como interferir de maneira legítima nesse sistema As pessoas olham o sistema penitenciário e frequentemente fecham os olhos na crença de que jamais passarão por aquilo Essa é a pior forma de insensibilidade nessa vida, que ocorre quando a gente tem certeza de que não vai passar por aquela situação"
Fechar os olhos," Confirmação de Voto Supremo Tribunal Federal Inteiro Teor do Acórdão - Página 31 de 32 ADI 917 / MG sim, a movimentação horizontal dentro da mesma carreira, muito embora com mudança de classe, e afastei a interpretação da lei, a ponto de contemplar a denominada movimentação verticalÉ a explicitação cabível, para não se pensar, no Colegiado, que estou a fechar os olhos ao disposto no artigo 37 da Constituição da República2 Documento assinado digitalmente conforme MP n° 2"
Fechar os olhos,"Deve-se celebrar a resposta institucional dada ao episódio, como uma reação à aceitação social e à impunidade de condutas contrárias à ética e à legislação Mas não se deve fechar os olhos ao fato de que o chamado “Mensalão” não constituiu um evento isolado na vida nacional, quer do ponto de vista quantitativo (isto é, dos valores envolvidos) quer do ponto de vista qualitativo (da posição hierárquica 3 Documento assinado digitalmente conforme MP n° 2200-2/2001 de 24/08/2001, que institui a Infraestrutura de Chaves Públicas Brasileira - ICP-Brasil"
Fechar os olhos,"”       As defesas apresentadas, na mesma audiência, da pretensão buscada nos autos, em especial as intervenções do Recorrente e do representante da Federação das Santas Casas de Misericórdia, Hospitais e Entidades Filantrópicas do Rio Grande do Sul, explicitaram questão que permeia toda a problemática aqui enfrentada: a grave crise econômica que atinge os hospitais brasileiros e a tentativa de solução parcial do problema por meio do cofinanciamento do sistema por parcela dos usuáriosÉ preciso afirmar que não se fecha os olhos a esta triste realidade enfrentada primordialmente pelas entidades filantrópicas e que coloca nosso sistema público de saúde muito aquém de todo o potencial que a Carta Cidadã lhe outorgouPorém, a alarmante situação desses nosocômios não pode ser resolvida às custas, justamente, da população mais carente e que mais necessita do SUS enquanto único meio para preservação de sua saúde e integridade"
Fechar os olhos," Antecipação ao Voto Supremo Tribunal Federal Inteiro Teor do Acórdão - Página 59 de 84 RE 724347 / DF que foi Relator e, com o voto proferido, vencedor na tese, o ministro Sepúlveda Pertence Quer dizer, não estou fechando os olhos a pronunciamentos do Tribunal Estou homenageando certo pronunciamento – e há precedentes para todos os gostos –, o precedente que entendo mais consentâneo com a espécie"
Fechar os olhos," MARCO AURÉLIO Supremo Tribunal Federal Inteiro Teor do Acórdão - Página 50 de 56 04/05/2016PLENÁRIOAÇÃO DIRETA DE INCONSTITUCIONALIDADE 2418 DISTRITO FEDERALO SENHOR MINISTRO MARCO AURÉLIO – Presidente, não posso fechar os olhos ao vício formal Diria que essa medida provisória já não poderia ser mais editada nos dias de hoje, porque a Emenda Constitucional nº 32, de 2001, obstaculizou o trato da matéria processual mediante medida provisória"
Fechar os olhos," A atividade desempenhada no Tribunal assume natureza administrativa, no que viabiliza o controle de legalidade, ante a superveniência de recursos administrativos interpostos por candidatos classificados, notadamente quando as informações do processo indicam a ocorrência de graves desvios Não se pode admitir que os responsáveis pela análise dos documentos fechem os olhos para situações nas quais, consoante destacado na manifestação do Procurador-Geral da República, candidatos teriam frequentado elevadíssimo número de cursos de pós-graduação, com duração mínima de 360 horas, em curto espaço de tempo, de forma presencial e em diferentes unidades da Federação Saliento, ainda, que não se está a assentar a legitimidade de restrição genérica relativamente à quantidade máxima de diplomas de pós-graduação – o que representaria ruptura com precedentes de minha relatoria no tocante à Resolução nº 187/2014/CNJ –,  mas apenas o reconhecimento de que situações de evidente abuso devem ser rechaçadas"
Fechar os olhos,"3 Diante das peculiaridades do caso concreto, exigir do digno prolator da decisão de pronúncia que se limitasse a meramente apontar a existência de indícios da autoria do crime seria o mesmo que lhe impor que fechasse os olhos às provas dos autos, afastando-se do princípio da primazia da realidade Por outro lado, e sendo certa a autoria, como proclamado na decisão de pronúncia, a tese a ser desenvolvida em favor do réu, no julgamento perante o Tribunal do Júri, é a da legítima defesa – e isto devidamente registrado na decisão em exame"
Fechar os olhos," Toda esta situação indica o enorme perigo que a liberdade de pessoas envolvidas representa não só para a ordem pública, podendo continuar a praticarem os crimes que, ao que parece, estão habituados, como também para a própria instrução, já que sem dúvida alguma quem é capaz de atacar com tantos tiros um veículo com policiais, matando até transeuntes, sem dúvida alguma não terá pudores em eventualmente fazer o mesmo com testemunhas que os possam prejudicar Ademais, não há como fechar os olhos ao fato de que todos os seis acusados possuem considerável FA, conforme pesquisas que ora junto, reforçando assim os indicativos de serem voltados à prática do ilícitoPortanto, mostrando-se imperiosa para a preservação da própria sociedade daquela região a prisão dos indiciados, e evidentemente sendo totalmente insuficiente qualquer outra medida cautelar, decreto a prisão preventiva de …, Edson Souza Silva Domingos, "
Fechar os olhos," Já ressaltei no Plenário que um suspiro no âmbito deste Tribunal repercute nos demais patamares do Judiciário O Supremo não pode fechar os olhos a uma situação jurídica como a que está em mesa para julgamento; o Supremo não pode dizer que continua sendo razoável, pela complexidade do processo, uma prisão provisória que já dura três anos, oito meses e nove dias Vamos esperar o terceiro habeas corpus, talvez o quarto, o quinto, o sexto? Quem sabe daqui a mais três anos cheguemos à conclusão de que há o excesso"
Fechar os olhos," No segundo, há crimes praticados em concurso de agentes, como é, data venia, a situação dos autos, na minha compreensão Não quero, em absoluto, fechar os olhos ao fato – destacado, inclusive, pelo eminente Relator - de que agentes podem se associar, originariamente, para fins lícitos e, em um dado momento, alterar a finalidade inicial da sua associação, dirigindo-a à prática reiterada de crimes Ainda, uma associação de pessoas pode ocorrer por finalidades várias, dentre elas a de cometer crimes, o que também configura o crime, agora denominado de associação criminosa"
Fechar os olhos,"Deve-se celebrar a resposta institucional dada ao episódio, como uma reação à aceitação social e à impunidade de condutas contrárias à ética e à legislação Mas não se deve fechar os olhos ao fato de que o chamado “Mensalão” não constituiu um evento isolado na vida nacional, quer do ponto de vista quantitativo (isto é, dos valores envolvidos) quer do ponto de vista qualitativo (da posição hierárquica das pessoas envolvidas) Justamente ao contrário, ele se insere em uma tradição lamentável, que vem de longe"
Fechar os olhos," No Tribunal de Justiça do Estado de São Paulo, não se logrou êxito, tampouco no Superior Tribunal de Justiça O Supremo, como última trincheira do cidadão, não pode fechar os olhos ao caso, não pode simplesmente assentar que se deve aguardar o julgamento, já sinalizado pelo relator, do Superior Tribunal de Justiça, permanecendo o paciente preso enquanto isso A preventiva faz-se sempre excepcional"
Fechar os olhos," DIAS TOFFOLI Supremo Tribunal Federal Inteiro Teor do Acórdão - Página 30 de 71 ADI 374 / DF Ora, Senhores Ministros, os Estados-membros não gozam de liberdade para retardar a transição de um regime constitucional a outro Tampouco podem fechar os olhos aos critérios expressos na Carta Magna e às decisões deste Tribunal Esta Suprema Corte, por sua vez, não pode deixar espaços para soluções normativas ou interpretativas que se prestem a um atraso ainda maior na implementação do modelo constitucional"
Fechar os olhos," 3 Embora o Poder Judiciário não possa fechar os olhos às restrições financeiras e orçamentárias dos entes públicos, situações de risco merecem a tutela jurisdicional, impondo-se, apenas, o estabelecimento de critérios para que o deferimento de pedidos não sobrecarregue o orçamento público 4"
Fechar os olhos," Cuida-se a ação ordinária, na qual o ora Recorrente pleiteia o amparo do Estado por meio de reforma militar e indenização por danos morais Neste recurso, busca o recorrente especificamente a fixação de indenização por danos morais, decorrentes de seu desligamento do Exército acometido de graves problemas de saúde, inclusive decorrentes do uso de crack, para o que as autoridades não podem fechar os olhos Assim, nos termos do quanto exposto na peça inicial, faz jus ao pedido, com base no que dispõem os arts"
Fechar os olhos,"  O  Marco  Civil  diz  isto:  as  empresas,  onde  quer  que  elas estejam, se envolverem brasileiros e seus dados pessoais, têm que se relacionar com a nossa legislação Essa tradução é importante, e nós não podemos fechar os olhos para essa dualidade  Colocar a pergunto em termos de segurança pública, contra a privacidade, é miopia"
Fechar os olhos,"  Precisamos  pensar  em  novas  formas  de  representação, acompanhando o mesmo movimento da evolução inevitável da comunicação em tempos de internet e de rede social Não dá para fechar os olhos a isso Todas essas formas  de  participação,  transparência  e  atuação  política  das  massas  em manifestações  de  rua,  manifestações  virtuais  e  acompanhamento  das  atividades dos Poderes da República estão mudando a forma de fazer política"
Fechar os olhos," Agindo em causa própria, o preso requereu habeas corpus ao STF O Ministro Celso de Mello rejeitou o pedido por questões processuais, mas não fechou os olhos para os fatos Ao verificar o lamentável estado de saúde do preso, no mesmo despacho em que negou o pedido, o Ministro, criticando a burocracia admi nistrativa, determinou que o Ministério Público, a Defensoria Pública e as secretarias estaduais de Administração Peniten ciária e da Justiça viabilizassem meios de atenuar o sofrimento do preso"
Fechar os olhos," Ora, como foi possível à maioria do Tribunal descobrir aí apoio para a sua conclusão, de que os militares eleitos vereadores não têm direito à dis ponibilidade? Não sei Há, porém, cousa ainda mais curiosa na decisão que estou combatendo, e é que, procurando medir a regra da disponibilidade pela exceção de vencimen tos especiais, foi o Tribunal pedir inspirações a uma lei já revogada, fechando os olhos à lei vigente que, submetida ao mesmo processo lógico, contrariaria abertamente as suas conclusões Com efeito, a Lei 2 , de 89 , foi revogada pela "
Fechar os olhos," O segundo eixo do programa apresentado pelo ministro é a atenção especial do Poder Judiciário sobre as condições físicas dos presídios ""A magistratura não pode fechar os olhos para a situação dos presos"", afirmou Lewandowski O último eixo do Cidadania nos Presídios é o acompanhamento do preso para que, ao ganhar a liberdade, tenha acesso a programas de assistência social, consiga ter direito a seus documentos pessoais e, principalmente, o acesso ao mercado de trabalho para que se efetive a reinserção social"
Fechar os olhos,"Deve-se celebrar a resposta institucional dada ao episódio, como uma reação à aceitação social e à impunidade de condutas contrárias à ética e à legislação Mas não se deve fechar os olhos ao fato de que o chamado “Mensalão” não constituiu um evento isolado na vida nacional, quer do ponto de vista quantitativo (isto é, dos valores envolvidos) quer do ponto de vista qualitativo (da posição hierárquica das pessoas envolvidas) Justamente ao contrário, ele se insere em uma tradição lamentável, que vem de longe"
Fechar os olhos," No segundo, há crimes praticados em concurso de agentes, como é, data venia, a situação dos autos, na minha compreensão Não quero, em absoluto, fechar os olhos ao fato – destacado, inclusive, pelo eminente Relator - de que agentes podem se associar, originariamente, para fins lícitos e, em um dado momento, alterar a finalidade inicial da sua associação, dirigindo-a à prática reiterada de crimes Ainda, uma associação de pessoas pode ocorrer por finalidades várias, dentre elas a de cometer crimes, o que também configura o crime, agora denominado de associação criminosa"
Fechar os olhos," Presentes os requisitos de vida em comum, coabitação,  mútua  assistência,  é  de  se  concederem  os mesmos direitos e se imporem iguais obrigações a todos os idênticas características vínculos tenham afeto que de Enquanto  a  lei  não  acompanha  a  evolução  da sociedade,  a  mudança  de  mentalidade,  a  evolução  do conceito de moralidade, ninguém, muito menos os juízes, pode fechar os olhos a essas novas realidades Posturas preconceituosas  ou  discriminatórias  geram  grandes injustiças"
Fechar os olhos,"Finalmente, um círculo de comportamentos que representam atentados intoleráveis ao ambiente, suscpetíveis de afectar as condições de vida em comunidade (ou mesmo as condições da própria existência da Humanidade): é precisamente aí que se torna necessária a intervenção penal O Direito Penal não pode fechar os olhos às transformações sociais que se dão na comunidade nem ficar de braços cruzados perante condutas altamente lesivas da possibilidade de vida em comunidade – pelo que negar a legitimidade da intervenção penal contra estas ofensas inadmissíveis seria adoptar um princípio da subsidiariedade “ao contrário”” (Direito Penal do Ambiente: a complexa construção dos tipos, a acessoriedade administrativa e o défice de aplicação"
Fechar os olhos," Não sei se no campo indenizatório ou nãoAgora, o que não podemos é fechar os olhos para situação jurídica que pode se repetir nos dias atuais, já que a regra da Constituição Federal de 1946 – e ressaltou o relator, bem como a Ministra Rosa Weber – foi repetida na Carta de 1967 e na verdadeira Carta de 1969 e também na de 1988 Agora, só pela passagem do tempo, julgar-se improcedente o pedido formulado na inicial é dar ao fato consumado – que reconheço, no Brasil, ter um peso incrível – envergadura a sobrepor-se, inclusive, à Constituição Federal"
Fechar os olhos,"E se Vossa Excelência permitir que me pronuncie como relator, faço-o para determinar a expedição do alvará de soltura, a ser cumprido com as cautelas próprias, ou seja, caso o paciente não esteja sob a custódia do Estado por motivo diverso da preventiva – que já não é tão provisória, porque dura seis anos – implementada pelo Juízo da 7ª Vara Criminal do Tribunal Regional Federal da 3ª Região, no processo que acabou sendo anulado pelo Superior Tribunal de JustiçaNão posso fechar os olhos ao excesso de prazo, diria um superexcesso de prazo Houve há nove anos a condenação, que já não se mostra subsistente, mas está o paciente preso preventivamente há seis"
Fechar os olhos," E essa atitude certamente contribui para a mudança de posicionamento do Poder Judiciário acerca do temaData máxima vênia, não é possível fechar os olhos para este posicionamento, e usar decisões anteriores a ela para, monocraticamente, dar provimento ao Recurso Extraordinário da ANTT – que é justamente a causadora do caos em que se encontra o setor de transporte interestadual de passageirosAinda no âmbito do Supremo Tribunal Federal, a Exma"
Fechar os olhos," No segundo, há crimes praticados em concurso de agentes, como é, data venia, a situação dos autos, na minha compreensão Não quero, em absoluto, fechar os olhos ao fato – destacado, inclusive, pelo eminente Relator - de que agentes podem se associar, originariamente, para fins lícitos e, em um dado momento, alterar a finalidade inicial da sua associação, dirigindo-a à prática reiterada de crimes Ainda, uma associação de pessoas pode ocorrer por finalidades várias, dentre elas a de cometer crimes, o que também configura o crime, agora denominado de associação criminosa"
Fechar os olhos,"Deve-se celebrar a resposta institucional dada ao episódio, como uma reação à aceitação social e à impunidade de condutas contrárias à ética e à legislação Mas não se deve fechar os olhos ao fato de que o chamado “Mensalão” não constituiu um evento isolado na vida nacional, quer do ponto de vista quantitativo (isto é, dos valores envolvidos) quer do ponto de vista qualitativo (da posição hierárquica das pessoas envolvidas) Justamente ao contrário, ele se insere em uma tradição lamentável, que vem de longe"
Fechar os olhos,"Deve-se celebrar a resposta institucional dada ao episódio, como uma reação à aceitação social e à impunidade de condutas contrárias à ética e à legislação Mas não se deve fechar os olhos ao fato de que o chamado “Mensalão” não constituiu um evento isolado na vida nacional, quer do ponto de vista quantitativo (isto é, dos valores envolvidos) quer do ponto de vista qualitativo (da posição hierárquica das pessoas envolvidas) Justamente ao contrário, ele se insere em uma 3 Documento assinado digitalmente conforme MP n° 2"
Fechar os olhos," Ele pode, inclusive, encontrar-se recolhido provisoriamente ou cumprindo pena pelos homicídios noticiados pela ministra Rosa Weber, fatos que descabe desconsiderarAgora, não posso fechar os olhos à circunstância de haver uma preventiva desde 5 de setembro de 2008Documento assinado digitalmente conforme MP n° 2"
Fechar os olhos,"Deve-se celebrar a resposta institucional dada ao episódio, como uma reação à aceitação social e à impunidade de condutas contrárias à ética e à legislação Mas não se deve fechar os olhos ao fato de que o chamado “Mensalão” não constituiu um evento isolado na vida nacional, quer do ponto de vista quantitativo (isto é, dos valores envolvidos) quer do ponto de vista qualitativo (da posição hierárquica das pessoas envolvidas) Justamente ao contrário, ele se insere em uma tradição lamentável, que vem de longe"
Fechar os olhos,"Presidente, e doutrina sobre a matéria? Temos, a meu ver, harmônica com os ditames maiores da Carta da RepúblicaCristina Zanello aponta que a COFINS não incide nas vendas inadimplidas – e não podemos fechar os olhos à doutrina:"" o fato gerador da COFINS não é o faturamento na acepção de contrato perfeito e acabado e sim o faturamento na acepção de total das receitas"" – então ela utiliza o texto normativo – ""AUFERIDAS"
Fechar os olhos," Sem dúvida Mostra-se inadmissível fechar os olhos e o coração ao que vivenciado diuturnamente por essas mulheres, seus companheiros e suas famílias Compete ao Supremo assegurar o exercício pleno da liberdade de escolha situada na esfera privada, em resguardo à vida e à saúde total da gestante, de forma a aliviá-la de sofrimento maior, porque evitável e infrutífero"
Fechar os olhos,"Deve-se celebrar a resposta institucional dada ao episódio, como uma reação à aceitação social e à impunidade de condutas contrárias à ética e à legislação Mas não se deve fechar os olhos ao fato de que o chamado “Mensalão” não constituiu um evento isolado na vida nacional, quer do ponto de vista quantitativo (isto é, dos valores envolvidos) quer do ponto de vista qualitativo (da posição hierárquica das pessoas envolvidas) Justamente ao contrário, ele se insere em uma 3 Documento assinado digitalmente conforme MP n° 2"
Fechar os olhos,"Deve-se celebrar a resposta institucional dada ao episódio, como uma reação à aceitação social e à impunidade de condutas contrárias à ética e à legislação Mas não se deve fechar os olhos ao fato de que o chamado “Mensalão” não constituiu um evento isolado na vida nacional, quer do ponto de vista quantitativo (isto é, dos valores envolvidos) quer do ponto de vista qualitativo (da posição hierárquica das pessoas envolvidas) Justamente ao contrário, ele se insere em uma 3 Documento assinado digitalmente conforme MP n° 2"
Fechar os olhos,"In casu, o abuso do poder de editar Medidas Provisórias afigura-se evidenciado de forma patente, sendo impossível defender com seriedade que a criação de um ente para desincumbir-se das mesmas atribuições de autarquia já em operação revista-se da urgência necessária para afastar a adoção do rito legislativo ordinárioPor outro lado, não pode a Corte fechar os olhos para os efeitos nocivos que a pronúncia de nulidade com efeitos retroativos pode acarretar para a sociedadeA proteção do meio ambiente, direito fundamental de terceira geração previsto no art"
