Abrir a boca," A sonda perfura o ambiente uterino e começa a sugar o líquido amniótico Ele, então, como que desesperado, começa a nadar, começa a fugir, mas a sonda lhe atinge as pernas, os pés, e começa a sugar as pernas e os pés, e ele abre a boca como quem grita, mas ninguém ouviu o grito dele Apenas o Doutor Bernard ouviu esse grito"
Abrir a boca,"  No  primeiro  cárcere,  o  peticionário  teve  que  tomar  banho  e  foi  revistado  para  verificar cicatrizes, marcas, tatuagens de gangues e contrabando enquanto tirava a roupa  Ele informou que também teve que abrir a boca, levantar a língua, estender os braços, virar-se e erguer a genitália Na segunda prisão, foi obrigado a retirar as roupas enquanto um oficial procurava por marcas corporais, feridas e contrabando"
Arrumar a casa,"Presidente, eu não só acompanho como cumprimento o Ministro Fux, que conseguiu uma freada de arrumação aqui Caíram uns dois ou três pela porta, mas a freada de arrumação era indispensável porque isso estava confuso e acho que o voto de Vossa Excelência não só arrumou a casa, como fez justiça às partesSupremo Tribunal FederalDocumento assinado digitalmente conforme MP n° 2"
Cair do céu," Só para pensarmos também que, às vezes, um recurso vem sem assinatura e é considerado inexistente E aquele recurso não caiu do céu; alguém colocou aquele recurso ali Quer dizer, isso também é outra questão formal"
Cair do céu,") Isto não é matéria de alta indagação, não é matéria trans cendente É como dizer o óbvio, por exemplo, a chuva cai do céu Não se precisa provar isso, porque é evidente que a chuva cai do céu"
Cair do céu,"009 MATO GROSSO DO SULO SENHOR MINISTRO MARCO AURÉLIO – Não há nem mesmo uma rubrica?O SENHOR MINISTRO DIAS TOFFOLI (PRESIDENTE E RELATOR):Nem rubrica, nem nas razõesO SENHOR MINISTRO LUIZ FUX - Mas deve ter uma procuração, porque esses recursos não caem do céu Eu tenho muita dificuldade de não conhecer um recurso porque ele não está assinado"
Cair do céu," Esse inciso III foi para consagrar, em dispositivo legal, aquilo que a jurisprudência tem assentado E o parágrafo único veio exatamente para esses casos em que os Tribunais não conhecem do recurso, porque não têm assinatura - o recurso não caiu do céu, o advogado vai lá e assina O SENHOR MINISTRO RICARDO LEWANDOWSKI (PRESIDENTE E RELATOR) - Entendi, um mero erro de natureza formal"
Dar um salto," E o legislador constitucional não impediu o legislador ordinário de, em determinadas situações especiais, ou específicas, como Vossa Excelência, Ministro Lewandowski, muito bem destacou no seu voto, possam ser dilargadas Eu até relembro que o artigo 927 do Código Civil de 2002 deu um salto em relação àquela velha regra de que ""responderá pelos danos quem agir por negligência, imperícia e imprudência"" Vejam o que diz hoje o Código Civil nessa virada de paradigma, nessa ruptura do paradigma, ao levar em consideração muito mais a tutela da pessoa humana do que a reparação do dano, a óptica patrimonialista"
Deixar de lado,"Não estou defendendo a violação do direito do menor ou o reprovável abuso do trabalho infantil Penso que é hora de refletir, de agir, de deixar de lado a burocracia e o apego ao formalismo e fazer algo para alterar a realidade do meio rural brasileiro Não se resolve o analfabetismo, a miséria, a falta de oportunidades com regras proibitivas, como se o homem do campo – e por que não o jovem do campo – tivesse alternativa para se manter"
Deixar de lado," , não se pode aplicar analogicamente legislação concernente a servidores públicos federais, ainda que esgote, com propriedade, a matériaNão obstante, e em que pese não desconheça julgado emanado do STJ em sentido diverso, interpretando teleologicamente a questão, não se podendo deixar de lado o escopo do PDV instituído pela LC nº10727/94 […] , o que, ao cabo, onere o Estado, cujo orçamento, por certo, não comportaria este bis in idem (indenização mais benefícios)"
Deixar de lado,"Se tiver que aguardar a apreciação do habeas formalizado no Tribunal de Justiça, posteriormente, no caso de indeferimento, o recurso ordinário constitucional para o Superior Tribunal de Justiça, evidentemente ele acabará cumprindo a pena em regime mais gravoso do que versado no títuloPor isso, penso – e Vossa Excelência concorda comigo, quanto aos fundamentos da preventiva serem insubsistentes – que o caso é excepcional e até não abordo a problemática do Verbete nº 691, porque, para mim, o habeas é adequado, desde que se articule um ato de constrangimento, ato ilegal a alcançar a liberdade de ir e vir do paciente, e exista órgão, acima daquele que o perpetrou, capaz de examinar a impetração, como é o Supremo, mas vamos deixar de ladoA SENHORA MINISTRA ROSA WEBER - Porque eu até superaria"
Deixar de lado," Terei que, evidentemente, indicar adiamento A queima de etapas não é possível, a não ser que a Turma queira deixar de lado a concepção do relator quanto ao extraordinário, e excluí-lo do quórum de julgamento É um passo demasiadamente largo e, creio, ninguém o dará"
Deixar de lado,"” (ATALIBA, Geraldo, Apontamentos de Ciência das Finanças, Direito Financeiro e Tributário, São Paulo: Revista dos Tribunais, 1969, p 148-9)Aliás, cumpre não olvidar que, além de ser instrumento de forte caráter extrafiscal, o imposto sobre produtos industrializados apresenta também destacada capacidade arrecadatória, aspecto que certamente não pode ser deixado de lado no caso em exameEnfim, o que se percebe é que falta outro fundamento para a restrição imposta pelo art"
Deixar de lado,"578 DISTRITO FEDERALDEBATEO SENHOR MINISTRO CEZAR PELUSO (PRESIDENTE) - Eu não vou antecipar o voto a respeito, mas só fazer uma ponderação Todas essas considerações de Vossas Excelências - como sempre muito respeitáveis e muito inteligentes - deixam de lado um problema que não pode ser considerado irrelevante: o problema da responsabilidade ética, que é o pressuposto da imputabilidade jurídica O Ministro Marco Aurélio usou expressão não jurídica para definir isso: ""Só se a pessoa fosse paranormal, ela teria alternativa de evitar o fato para, dali a alguns anos, não sofrer a restrição"""
Deixar de lado,"O SENHOR MINISTRO CELSO DE MELLO - (Relator): Bastante clara, portanto, a posição do Tribunal no sentido de que se está garantindo a incolumidade, a integridade do exercício desses direitos, observados, evidentemente, os limites que a própria Constituição estabelece O SENHOR MINISTRO AYRES BRITTO - Eu termino dizendo que também deixo de lado o problema da frequência ou da participação em reunião de crianças e adolescentes, porque eu me remeto para o artigo 227 da Constituição, que é cuidadoso, e me parece que, no particular, fica a cargo de cada famíliaSenhor Presidente, eu acompanho o voto do Relator integralmente"
Deixar de lado," Àquela época, asseverou que não havia conveniência na suspensão dos provimentos impugnados em que lhe pese à plausibilidade dos fundamentos da inicial Já agora, no julgamento de fundo, o Supremo, até mesmo deixando de lado reiterados pronunciamentos últimos quanto à inconstitucionalidade, aponta que não é conveniente proclamar a pecha, a inconstitucionalidade dos Provimentos JudiciaisSurge quadro a gerar certa incongruência, tendo em conta o princípio da impessoalidade"
Deixar de lado," 249, § 2º, do CPC aplicado analogicamente ao CPP, nos termos do disposto no art 3º do CPP), estão prejudicando o próprio judiciário brasileiro ao deixar de lado princípios como celeridade processual, eficiência e utilidade da jurisdição, dignidade da pessoa humana, devido processo legal, contraditório, ampla defesa”Requer a reconsideração da decisão agravada ou o provimento do presente recurso"
Deixar de lado,"br/portal/autenticacao/ sob o número 8059107 Relatório Supremo Tribunal Federal Inteiro Teor do Acórdão - Página 4 de 10 ARE 853495 AGR / SP dispositivos legais e constitucionais que ensejaram a propositura do agravo, desprovendo o Agravo em Recurso Extraordinário, baseando-se em leis infraconstitucionais, deixando de lado o artigo 183 da Constituição Federal e a Súmula 237 do Supremo Tribunal Federal, bem como não adentrou no mérito do presente recurso para a aplicação da Constituição FederalTrata o artigo 183 da Constituição Federal:'Aquele que possuir como sua área urbana de até duzentos e cinquenta metros quadrados, por cinco anos, ininterruptamente e sem oposição, utilizando-a para sua moradia ou de sua família, adquirir-lhe-á o domínio, desde que não seja proprietário de outro imóvel urbano ou rural"
Deixar de lado,"A culpabilidade, a questão dos motivos, as circunstâncias e as consequências do crime são aquelas típicas à espécie, não desbordam da normalidade e da própria sanção penal, que é prevista, em tese, para uma conduta dessa naturezaO eminente Ministro Luiz Fux, amparado nos precedentes da Casa, fazendo menção aos antecedentes, deixou de lado ou desconsiderou eventuais anotações relativas a vita ante acta do réu, porquanto ainda não transitadas em julgado Portanto, os antecedentes, aqui, não pesam na avaliação"
Deixar de lado," Debate Supremo Tribunal Federal Inteiro Teor do Acórdão - Página 16 de 63 07/05/2013PRIMEIRA TURMAMANDADO DE SEGURANÇA 29599 DISTRITO FEDERALDEBATEA SENHORA MINISTRA ROSA WEBER - Senhor Presidente, fiquei vivamente impressionada com as razões expostas pelo eminente patrono da impetrante ao destacar duas questões de direito muito claras e  que deixariam de lado o segundo aspecto em que se centra o eminente RelatorAcompanho o voto do eminente Relator, sem dúvida, quanto a esse aspecto"
Deixar de lado," Parece piada, mas a censura era e é das próprias emissorasA despeito dessas considerações, não posso deixar de lado a compreensão do momento histórico É claro que a Associação autora preocupa-se com certas externalidades negativas de arranjos políticos internacionais, em que se estabeleceram formas indiretas de controle das mídias"
Deixar de lado," A definição da envergadura do diploma, se lei ordinária, propriamente dita, ou complementar, decorre do tema tratado nessa mesma lei, da matéria nela versada Mas deixo de lado essa óptica, no que isolada no PlenárioCaso pudesse caminhar para a opção política – não posso, evidentemente –, o faria no sentido de exigir, quanto à deliberação dos representantes do povo, dos deputados estaduais, escore mais significativo, para não se estar, a partir da mania de se acreditar que poderemos ter melhores dias no Brasil via novas leis, mudando a disciplina de certos temas"
Deixar de lado," DIAS TOFFOLI Supremo Tribunal Federal Inteiro Teor do Acórdão - Página 150 de 197 ADI 5105 / DF partidária decorrente da criação de partido novo, reconhecida e estimulada constitucionalmente, mas, sim, de casos pessoais e individuais de troca de partidoEm meu sentir, permitir que as normas impugnadas subsistam em nosso ordenamento jurídico seria deixar de lado a representatividade de partidos que já nascem, ao receber parlamentares oriundos de outros partidos, com força política nacional, frustando, assim, sua participação nos processos eleitorais de forma compatível e condizente com a representatividade política que ostentam e com a legitimidade popular recebida por seus membros das urnasPor fim, conforme já assinalado no início deste voto, o entendimento aqui adotado está em consonância a jurisprudência firmada por este Tribunal no julgamento da ADI nº 4"
Deixar de lado," Voto - MIN TEORI ZAVASCKI Supremo Tribunal Federal Inteiro Teor do Acórdão - Página 23 de 65 MS 34127 MC / DF O SENHOR MINISTRO GILMAR MENDES - Vossa Excelência me permite? Há um outro aspecto que acho que estamos deixando de lado, com a banalização, inclusive, das impetrações por parte de parlamentares A jurisprudência do Tribunal, em relação à impetração de mandado de segurança contra atos de mesa, é bastante restrita - e era bastante restrita - a eventos, por exemplo, ligados a incidentes graves na feitura de emenda constitucional"
Deixar de lado,"412 / AL trabalho não deixava dúvida de haver cerceio ao direito de locomoção, o que levou o Ministro Sepúlveda Pertence a consignar que o tipo do artigo 149 do Código Penal constitui “atentado à liberdade individual” do trabalhador No caso em exame, deixando de lado a precariedade das condições de trabalho verificadas, o que motivou, até mesmo, a interdição do estabelecimento investigado, há de se indagar se a matéria fática dos autos, em especial depoimentos, revela a sujeição dos prestadores de serviços a trabalhos forçados mediante a restrição do direito de locomoção Extrai-se dos “Termos de Depoimento Pessoal de Trabalhador”, tomados nos dias 5 e 6 de março de 2008:Iranaldo da Silva Batista – admitido em 1º/10/2007: “QUE veio por conta própria procurar emprego; QUE desde o início desta safra está alojado; ("
Deixar de lado,"92014, que:“Qualquer que seja a decisão a adotar, penso que não se pode deixar de lado o escopo e o contexto socioeconômico subjacentes, no caso, à edição do Decreto-Lei nº 2284, de 10 de março de 1986 (Plano Cruzado), assim como dos demais planos econômicos que adotaram o chamado congelamento de preços no Brasil, em décadas passadas, e que, segundo se alega, seriam causa do dano material em questão   "
Deixar de lado, Voto - MIN MARCO AURÉLIO Supremo Tribunal Federal Inteiro Teor do Acórdão - Página 7 de 8 ARE 963934 AGR / SP deixado de lado pelo evidente efeito jurídico “erga omnes” da decisão do Supremo Tribunal FederalComo admitir que a mesma questão não tenha a guarida do Poder Judiciário?O presente agravo deve ser provido para reformar a r
Deixar de lado," Além de não ser adequado o manejo de apelo extremo para rever dosimetria da pena, matéria de cunho eminentemente infraconstitucional, reitero que o magistrado sentenciante optou, como permite o art 331 do Código Penal, por aplicar somente a pena de multa, deixando de lado a privativa de liberdade Essa escolha, extremamente favorável ao condenado, já revela que a alegação de excesso sancionatório não guarda relação com a realidade dos autos"
Deixar de lado,"963 MATO GROSSO DO SULEXPLICAÇÃOA SENHORA MINISTRA ROSA WEBER - Senhor Presidente,  só quero fazer, então, uma correção Fiquei com a impressão de que o voto que eu trouxera, na mesma linha do agora proposto pelo Ministro Dias Toffoli, deixa de lado a teoria do conglobamento e observa a norma na parte em que favorece o réu, fiquei com a ideia de que tinha passado na Turma, por isso me referi à jurisprudência da TurmaO SENHOR MINISTRO MARCO AURÉLIO – Eu me refiro a precedentes anteriores quando a Turma tinha composição diversa: com o Ministro Ricardo Lewandowski, e  a Ministra Cármen Lúcia"
Deixar de lado,"Não estou defendendo a violação do direito do menor ou o reprovável abuso do trabalho infantil Penso que é hora de refletir, de agir, de deixar de lado a burocracia e o apego ao formalismo e fazer algo para alterar a realidade do meio rural brasileiro Não se resolve o analfabetismo, a miséria, a falta de oportunidades com regras proibitivas, como se o homem do campo e, por que não, o jovem do campo tivessem alternativa para se manter"
Deixar de lado,"Para concluir, no meu sentir, declarar a inconstitucionalidade da interpretação questionada pelos autores da ADI nº 4795 seria deixar de lado a representatividade de partidos que já nascem, ao receber parlamentares oriundos de outros partidos, com força política nacional, frustando, assim, sua participação nos processos eleitorais de forma compatível e condizente com a representatividade política que ostentam e com a legitimidade popular recebida por seus membros das urnasPor todas essas razões, reputo constitucional a interpretação que reconhece aos partidos criados após a realização de eleições para a Câmara dos Deputados o direito à devida proporcionalidade na divisão do tempo de propaganda eleitoral no rádio e na televisão prevista no inciso II do § 2º do art"
Deixar de lado," Além de não ser adequado o manejo de apelo extremo para rever dosimetria da pena, matéria de cunho eminentemente infraconstitucional, reitero que o magistrado sentenciante optou, como permite o art 331 do Código Penal, por aplicar somente a pena de multa, deixando de lado a privativa de liberdade Essa escolha, extremamente favorável ao condenado, já revela que a alegação de excesso sancionatório não guarda relação com a realidade dos autos"
Deixar de lado,"01815994-9) tanto pelos fatos inscritos na primeira imputação quanto pelos fatos novos descritos na segunda acusação;ii) o Juízo da 6ª Vara Federal Criminal do Rio de Janeiro, contudo, ao sentenciar a segunda ação penal, deixou de lado os 12 Supremo Tribunal FederalDocumento assinado digitalmente conforme MP n° 2200-2/2001 de 24/08/2001, que institui a Infraestrutura de Chaves Públicas Brasileira - ICP-Brasil"
Deixar de lado," Também me considero, Presidente, na Suprema Corte, mas, desde cedo percebi que, quanto mais remota a possibilidade de revisão de uma óptica, maior deve ser o apego ao direito posto, maior deve ser a fidelidade aos princípios, maior deve ser o receio em claudicar na arte de proceder e de julgarNão é por não existir, acima do Supremo, órgão capaz de examinar o acerto ou o desacerto das decisões que profira que poderemos, simplesmente, fechar a legislação e deixar de lado a Constituição Federal para implementar – segundo nosso critério, nossa formação simplesmente humanística, colocada a técnica em segundo plano – a solução que entendamos mais adequadaPresidente, repito que este julgamento, a meu ver, cairá no vazio, a não ser que se empreste à ação ajuizada – renovada, diria – contornos de ação rescisória e se retire do mundo jurídico o pronunciamento judicial anterior como um todo"
Deixar de lado," Sem prejuízo das relevantes questões constitucionais levantadas em cada uma das manifestações precedentes, que podem se projetar para outros campos além do Direito Tributário, lembro que a litigiosidade aguerrida é um traço relativamente comum das demandas tributárias Nesse contexto, parece-me crucial deixar de lado as filigranas próprias da hermética legislação tributária para focar as ligações que o tema tem em relação aos valores fundamentais da Constituição Discutimos se a legislação do IRPJ pode definir o momento no qual se considera que as empresas estrangeiras disponibilizam lucros às empresas coligadas ou controladoras domiciliadas no Brasil, independentemente da efetiva distribuição econômica ou da deliberação 6 227 Documento assinado digitalmente conforme MP n° 2"
Deixar de lado,"] o entendimento manifestado na origem põe em xeque a estrutura normativa da prestação dos serviços de telecomunicações no País A desconsiderar as atribuições da agência reguladora em tela, deixando de lado regras específicas a respeito do serviço prestado, estar-se-ia perpetrando uma invasão de competências constitucionalmente prevista, além de criar um temerário precedente do setor estratégico das telecomunicações, o qual pode ser potencialmente danoso, especialmente em um país de dimensões continentais como o Brasil, cujas especificidades geográficas são as mais variadas []” (doc"
Deixar de lado," 38 MARCO CIVIL DA INTERNET E BLOQUEIO JUDICIAL DO WHATSAPP Em  terceiro  lugar,  as  mensagens  enviadas  entre  os  dois sistemas são criptografadas de ponta a ponta usando um túnel seguro para o qual o WhatsApp não tem a chave Mesmo deixando de lado o WhatsApp Web, o  WhatsApp  não  pode  espelhar  uma  conta  de  WhatsApp  de  forma  que  as mensagens sejam entregues a outros smartphones ou outros computadores nos seus sistemas atuais Uma vez que as mensagens são criptografadas de ponta a ponta,  não  podem  ser  retiradas  da  criptografia"
Deixar de lado," Permita-me, Vossa Excelência, a pergunta: o que está no âmago dos direitos fundamentais? Desde a origem do  conceito, na essência  dos direitos fundamentais,  está  a  tolerância  enquanto  genuína  a  aceitação  do  outro,  o  que 591 Funcionamento do Fundo Nacional sobre Mudança do Clima (Fundo Clima) e políticas públicas em matéria ambiental – ADPF 708 perpassa  todas  as  gerações  de  direitos  fundamentais  e  chega  inclusive  no  nosso amigo aqui em debate, direito ao meio ambiente saudável e sustentável  A  atitude  de  abertura  ao  outro  deve  começar  entre  nós,  isso envolve deixar de lado compreensões sectárias, atitude que é própria àqueles que realmente buscam realizar e promover o bem comum Não tenho a menor dúvida: nesses  dois  dias,  tivemos  todos  verdadeira  abertura  de  espírito,  no  intuito  de conhecer  e  reconhecer  as  múltiplas  iniciativas,  inclusive  políticas  públicas  do Estado brasileiro, destinadas à proteção e à promoção do direito fundamental ao meio  ambiente  saudável  e  sustentável"
Deixar de lado,"  Se  não  se  faz  é  porque  não  é  possível  E  se  há  pessoas  ou entidades brasileiras - e permitam-me que sejam estrangeiras -  que colocaram 55 de 159 Supremo Tribunal Federal a mão ou que cometeram erros ou fraudes, que sejam processados pela Justiça; para  isso  existe  a  Justiça,  mas  não  a  intervenção  do  Estado,  porque  é  muito fácil,  muito  possível  que  seja  criada  uma  lei  que  não  possa  ser  cumprida,    e que depois se deixe de lado o  cumprimento dessa norma E,  além  disso,  no  Brasil,  que  tem  uma  extensão  enorme,  é um continente, ou seja, vocês têm um país maravilhoso, que é um continente"
Deixar de lado, A SRA MINISTRA ELLEN GRACIE (PRESIDENTE E RELATORA) - A seleção desses acórdãos buscou deixar de lado todos aqueles julgados que  tratassem  de  matéria  penal  E  nos  restringimos  apenas  à  citação  dos acórdãos que dizem respeito à prevalência da legislação federal
Deixar de lado,") desde cedo percebi que, quanto mais remota a possibilidade de revisão de uma óptica, maior deve ser o apego ao direito posto, maior deve ser a fidelidade aos princípios, maior deve ser o receio em claudicar na arte de proceder e de julgar Não é por não existir, acima do Supremo, órgão capaz de examinar o acerto ou o desacerto das decisões que profira que poderemos, simplesmente, fechar a legislação e deixar de lado a Constituição Federal para implementar — segundo nosso critério, nossa formação simplesmente humanística, colocada a técnica em segundo plano — a solução que entendamos mais adequada” RE 3 3"
Deixar de lado," 9, § º, da Constituição de 9 7 5 8 Ministro Aliomar Baleeiro entanto, o voto do Ministro Leitão de Abreu, que deixava de lado esse problema e reconhecia haver harmonia entre o CTN e o decreto lei objeto do caso concreto Controle do quantum de multa fiscal No RE n"
Deixar de lado," Diante disso, eles embargaram Ao analisar o caso, o Relator, Ministro candido Motta, enten deu que a empresa não se havia transferido quando notificada e só quando achou conveniente, deixando de lado os interesses dos empregados Os demais Ministros apresentaram posições divergentes em algumas partes e coinciden tes em outras"
Deixar de lado," Gran des juristas entendem que a regra da inviolabilidade não se justifica não haveria razão para que o exercício do mandato parlamentar justificasse a prática de um delito, impunemente Mas, deixando de lado esta observação, passo a examinar o conteúdo desse dispositivo O eminente Ministro Leitão de Abreu mostrou que se filia ao dispositivo da Cons tituição Alemã, que é a única que consigna"
Deixar de lado," A Constituição teria estabelecido mecanismo apto a oferecer aos telespectadores das diversões públicas e de programas de rádio e televisão as indicações, as informações e as recomendações necessárias acerca do conteúdo veiculado O sistema de classificação indicativa seria, então, ponto de equilíbrio tênue adotado pela Constituição para compatibilizar os dois postulados, a fim de velar pela integridade das crianças e dos adolescentes sem deixar de lado a preocupação com a garantia da liberdade de expressão O texto constitucional buscaria conferir aos pais, como reflexo do exercício do poder familiar, o papel de supervisão efetiva sobre o conteúdo acessível aos filhos, enquanto não plenamente aptos a conviver com os influxos prejudiciais do meio social"
Deixar de lado," Demais dúvidas e sugestões de utilização do novo sistema consulte o “FAQ Pet v2” Esperamos que você tenha uma boa experiência com o novo sistema, que foi desenvolvido com foco especial nas necessidades dos usuários, sem deixar de lado a segurança e a comodidade que o processo eletrônico proporciona"
Deixar de lado," Demais dúvidas e sugestões de utilização do novo sistema consulte o “FAQ Pet v2” Esperamos que você tenha uma boa experiência com o novo sistema, que foi desenvolvido com foco especial nas necessidades dos usuários, sem deixar de lado a segurança e a comodidade que o processo eletrônico proporciona"
Deixar de lado,"” (eDOC 14, p 8-9)Já o Tribunal paulista assim decidiu:“Não se pode deixar de lado que o regime prisional tem como objetivo reeducar o indivíduo insubordinado à lei e proteger a sociedade, que não pode ficar à mercê do infrator O 2 Documento assinado digitalmente conforme MP n° 2"
