Deixar de lado,"É exatamente o caso que está sendo julgado nesta Corte no momento Mesmo que seja mais benéfico, para não dizer inevitável, optar pela mecanização da colheita da cana, por conta da saúde do trabalhador e da população que vive nas proximidades da área de cultura, pelo aumento significativo da produtividade e consequente lucro, não se pode deixar de lado o meio pelo qual se considere mais razoável de obtenção deste objetivo: proibição imediata ou eliminação gradualPor óbvio, afigura-se muito mais harmônico com a disciplina constitucional, a eliminação planejada e gradual da queima da cana"
Deixar de lado," A definição da envergadura do diploma, se lei ordinária, propriamente dita, ou complementar, decorre do tema tratado nessa mesma lei, da matéria nela versada Mas deixo de lado essa óptica, no que isolada no Plenário” Assim, a previsão, na Constituição do Estado do Rio de Janeiro, da regência, quanto ao Estatuto dos Militares, mediante lei complementar não conflita com a Constituição Federal"
Deixar de lado,"A Lei de 1964 mostrou-se categórica, em bom vernáculo, quanto à gratuidade do selo O que houve, então, após? E já estou deixando de lado a discussão quanto à natureza do que cobrado O Decreto-Lei previu que o todo-poderoso da época, Ministro da Fazenda, poderia determinar o ressarcimento de custo e demais encargos"
Deixar de lado," 637-639, alegando em síntese:“() No caso, com a devida vênia, as ofensas constitucionais restaram sim evidenciadas no recurso extraordinário e o Judiciário tem obrigação constitucional de dar por inteiro a tutela jurisdicional, sendo-lhe vedado escolher esse ou aquele dispositivo legal, deixando de lado aqueles invocado, sobre os quais, na pior das hipóteses, haveria de se pronunciar, dando ao menos as razões pelas quais não se aplicariam ao caso em questão, sob pena de ofensa ao devido processo constitucional” (fl 638)"
Deixar de lado,"Ao negar a concessão da vantagem à Agravante em período diverso ao recesso escolar, o Eg TJRS fundou-se na análise da legislação estadual, deixando de lado o disposto no art 7º, inciso XVII da CF, que garante o direito às férias a todo trabalhador"
Deixar de lado,"De outra parte, tratando-se, como se trata, de imunidade e não de isenção, não se aplica o disposto no artigo 111, II, do Código Tributário Nacional, que impõe a interpretação literal da legislação tributária que disponha sobre outorga de isenção Para a exegese da imunidade, como instituto constitucional que é, podem ser utilizados todos os métodos empregados na interpretação dos textos constitucionais, e, assim, sem se deixar de lado a exegese literal ou gramatical porque a interpretação não deve ultrapassar os limites do conteúdo significativo das palavras da norma, há de se usar necessariamente da interpretação lógica, onde, na hermenêutica constitucional, avulta o valor do elemento teleológicoOra, é manifesto que a finalidade a que visa a Constituição com essa imunidade é a de evitar que haja excessiva oneração fiscal desses bens - energia elétrica, combustíveis líquidos e gasosos, lubrificantes e minerais - que são de vital importância para a economia nacional, e que, assim, teriam seus preços de venda demasiadamente aumentados"
Deixar de lado,"675 RIO DE JANEIROV O T OA Senhora Ministra Ellen Gracie - Acompanho o Relator, Presidente Não há dúvida de que, não obstante a brilhante sustentação oral em que o eminente defensor demonstrou conhecer a fundo a jurisprudência da Casa, o Relator me convence das peculiaridades desse caso, que é um caso emblemático para que o nosso Judiciário deixe de lado certos formalismos e autorize as oitivas por videoconferência Sem quaisquer dúvidas mais, sejam superadas as resistência a esse propósito"
Deixar de lado," decisão recorrida” No segundo agravo regimental, aduz que “o status jurídico de inocência apenas cede ao influxo de sentença transitada em julgada, nada mais adequado que deixar de lado na estipulação da pena, aqueles tantos fatos cuja definitividade ainda não se deu pela força da irrecorribilidade de uma decisão condenatória”Documento assinado digitalmente conforme MP n° 2"
Deixar de lado," É inafastável a idéia de que ao Estado incumbe motivar suas decisões, estabelecendo pleno vínculo de causa e efeito entre a ação do particular e a atuação da administração Ao deixar de lado as considerações do agente acerca do elemento subjetivo do Supremo Tribunal FederalDocumento assinado digitalmente conforme MP n° 2200-2/2001 de 24/08/2001, que institui a Infraestrutura de Chaves Públicas Brasileira - ICP-Brasil"
Deixar de lado," Ou seja, demonstrou que a visão monocular não lhe retira a capacidade de agir com segurança e precisão quando há necessidade de uso de arma de fogo”E não se está aqui deixando de lado o princípio da supremacia do interesse público Pelo contrário, o interesse público está sendo observado ao dar-se nomeação e posse a candidato que demonstrou, à saciedade, sua aptidão para o 10 Supremo Tribunal FederalDocumento assinado digitalmente conforme MP n° 2"
Deixar de lado,"92014, que:“Qualquer que seja a decisão a adotar, penso que não se pode deixar de lado o escopo e o contexto socioeconômico subjacentes, no caso, à edição do Decreto-Lei nº 2284, de 10 de março de 1986 (Plano Cruzado), assim como dos demais planos econômicos que adotaram o chamado congelamento de preços no Brasil, em décadas passadas, e que, segundo se alega, seriam causa do dano material em questão"
Deixar de lado," Deste mesmo mal padecem as Bill of Rights americanas Elas estabeleceram a igualdade natural e universal dos homens como núcleo normativo básico, mas deixaram de lado a igualdade social, bem como o reconhecimento dos direitos políticos e civis dos negros, das mulheres e dos índios ("
Deixar de lado," Voto - MIN GILMAR MENDES Supremo Tribunal Federal Inteiro Teor do Acórdão - Página 106 de 128 RE 571969 / DF inflacionárias no contexto dos sucessivos planos econômicos adotados nas décadas de 80 e 90? Qualquer que seja a decisão a adotar, penso que não se pode deixar de lado o escopo e o contexto socioeconômico subjacentes, no caso, à edição do Decreto-Lei nº 2284, de 10 de março de 1986 (Plano Cruzado), assim como dos demais planos econômicos que adotaram o chamado congelamento de preços no Brasil, em décadas passadas, e que, segundo se alega, seriam causa do dano material em questão"
Deixar de lado," Voto - MIN GILMAR MENDES Supremo Tribunal Federal Inteiro Teor do Acórdão - Página 7 de 11 HC 132472 / SP A prisão do indiciado é necessária para a garantia da ordem pública, aturdida em decorrência da gravidade do delito e sua condição de equiparado aos hediondos, não sendo possível deixar de lado a significativa quantidade de entorpecentes apreendida e seu provável destino ao consumo de terceiros” (eDOC 5, p"
Deixar de lado," JOAQUIM BARBOSA Supremo Tribunal Federal Inteiro Teor do Acórdão - Página 11 de 41 ADI 4270 / SC Note-se, também, que a ênfase do modelo catarinense na assistência jurídica prestada sob o ângulo do apoio ao litígio judicial deixa de lado todos os esforços que vem sendo empreendidos por várias organizações no sentido de consolidar a cultura da resolução extrajudicial de disputas A defensoria pública como instituição do Estado encontra-se apta para atuar nessa frente, linha de ação essencial para reduzir a quantidade de processos e tornar mais ágil o funcionamento da justiça (inc"
Deixar de lado,"De outra parte, tratando-se, como se trata, de imunidade e não de isenção, não se aplica o disposto no artigo 111, II, do Código Tributário Nacional, que impõe a interpretação literal da legislação tributária que disponha sobre outorga de isenção Para a exegese da imunidade, como instituto constitucional que é, podem ser utilizados todos os métodos empregados na interpretação dos textos constitucionais, e, assim, sem se deixar de lado a exegese literal ou gramatical porque a interpretação não deve ultrapassar os limites do conteúdo significativo das palavras da norma, há de se usar necessariamente da interpretação lógica, onde, na hermenêutica constitucional, avulta o valor do elemento teleológicoOra, é manifesto que a finalidade a que visa a Constituição com essa imunidade é a de evitar que haja excessiva oneração fiscal desses bens - energia elétrica, combustíveis líquidos e gasosos, lubrificantes e minerais - que são de vital importância para a economia nacional, e que, assim, teriam seus preços de venda demasiadamente aumentados"
Deixar de lado," 61, § 1º, II, b; c/c art 84, III e VI, a, da Constituição, por atribuir obrigações institucionais ao Executivo; e (c) as regras não tratam prioritariamente de proteção à saúde, porque, ao limitar sua cobertura à esfera dos professores da rede pública de ensino, deixaram de lado um amplo espectro da categoria, como os professores da rede privadaÉ o relatório"
Deixar de lado," Ainda a partir de suposição, registrou-se que o paciente teria pretendido afastar a eficácia das sanções, mencionando-se postura que se circunscreve à autodefesa, isto é, o fato de ele, junto a autoridade policial, haver lançado inverdade - contaminação por vírus do computador que utilizava Está-se a ver que esses dados não se coadunam com os que formalmente e legalmente podem alicerçar a inversão da ordem natural das coisas, deixando de lado a possibilidade de aguardar-se, livre, o desfecho de ação penalAcrescento que o Verbete nº 691 da Súmula do Supremo versa a competência deste e não de qualquer outro Tribunal"
Deixar de lado," Sem prejuízo das relevantes questões constitucionais levantadas em cada uma das manifestações precedentes, que podem se projetar para outros campos além do Direito Tributário, lembro que a litigiosidade aguerrida é um traço relativamente comum das demandas tributárias Nesse contexto, parece-me crucial deixar de lado as filigranas próprias da hermética legislação tributária para focar as ligações que o tema tem em relação aos valores fundamentais da ConstituiçãoDiscutimos se a legislação do IRPJ pode definir o momento no qual se considera que as empresas estrangeiras disponibilizam lucros às empresas coligadas ou controladoras domiciliadas no Brasil, independentemente da efetiva distribuição econômica ou da deliberação jurídica dos respectivos órgãos de gestão"
Deixar de lado,"Mas releva o seguinte: se o sistema jurídico, em reverência à liberdade como o maior bem depois da vida humana, permite que qualquer tribunal, em qualquer circunstância e, portanto, independentemente de formalidades, possa conceder ordem ex officio, por que vamos prender-nos a formalidades para não examinar o pleito de liberdade dos ora pacientes? Até porque não se trata de um único paciente ao qual foi concedido liminar, mas também de outro paciente ao qual não se concedeu a ordem, não se concedeu a liminarDe modo que a mim me parece que o Tribunal deva deixar de lado particularidades, que são importantes, não digo que não sejam importantes, a forma é importante, mas acho que, no caso, como está em jogo a liberdade de duas pessoas, uma delas, já, provisoriamente, resguardada sob esse ponto de vista, mas a outra ainda não, o Tribunal podia superar, pela singularidade da hipótese, requisitos formais e adentrar, desde logo, no julgamento de mérito, porque estamos  Documento assinado digitalmente conforme MP n° 2200-2/2001 de 24/08/2001, que institui a Infraestrutura de Chaves Públicas Brasileira - ICP-Brasil"
Deixar de lado," Tanto é verdade, que a Lei n° 10084/93, passou a estabelecer o escalonamento vertical, apenas, entre Comissário de Polícia, Inspetor de Polícia e Investigador Policial, deixando de lado os Delegados de Polícia que, como sabido, têm legislação específica("
Deixar de lado," Debate Supremo Tribunal Federal Inteiro Teor do Acórdão - Página 350 de 383 16/02/2012PLENÁRIOAÇÃO DECLARATÓRIA DE CONSTITUCIONALIDADE 29 DISTRITO FEDERALDEBATEO SENHOR MINISTRO CEZAR PELUSO (PRESIDENTE) - Eu não vou antecipar o voto a respeito, mas só fazer uma ponderação Todas essas considerações de Vossas Excelências - como sempre muito respeitáveis e muito inteligentes - deixam de lado um problema que não pode ser considerado irrelevante: o problema da responsabilidade ética, que é o pressuposto da imputabilidade jurídica O Ministro Marco Aurélio usou expressão não jurídica para definir isso: ""Só se a pessoa fosse paranormal, ela teria alternativa de evitar o fato para, dali a alguns anos, não sofrer a restrição"""
Deixar de lado,"VOTOO SR MINISTRO CARLOS BRITTO – Senhora Presidente, se não é possível proclamar a modulação por falta de quorum, eu voto para dar interpretação conforme no sentido de que recuso a incidência de qualquer interpretação que signifique deixar de lado a regra da classificação, porque estou votando no pressuposto de que todos fizeram concurso O SENHOR MINISTRO CEZAR PELUSO – A discussão é quanto ao problema da prospectividade da eficácia, só"
Deixar de lado," Todos têm direito ao meio ambiente ecologicamente equilibrado, bem de uso comum do povo e essencial à sadia qualidade de vida, impondo-se ao Poder Público e à coletividade o dever ()""Então, nós sempre temos falado no constitucionalismo como deveres do Estado, e deixamos de lado uma sociedade democrática, para formar esse Estado democráticoEu acho que o § 1º, ao se referir à vedação que o Poder Público deve impor, é exatamente no sentido de que, se a coletividade sozinha não conseguir fazer com que o folclore e a cultura seja produção em benefício da vida e da dignidade, incumbe ao Estado vedar práticas que conduzam a isso"
Deixar de lado," Há certamente aí um custo de oportunidade, uma escolha trágica nessa questão Para dar fim, subitamente, ao estoque de precatórios, que outros gastos deverão deixar de lado os Estados e Municípios? O orçamento público, todos sabemos,  não é infinito, e os direitos fundamentais – todos eles, diga-se! – têm custosPortanto, o aumento imediato da destinação de recursos ao pagamento de precatórios decerto haverá de se fazer em prejuízo de outros valores constitucionais igualmente relevantes"
Deixar de lado,"O SENHOR MINISTRO RICARDO LEWANDOWSKI - Admitiu! Vossa Excelência poderia ter considerado improcedente o pedidoO SENHOR MINISTRO JOAQUIM BARBOSA (PRESIDENTE E RELATOR) - Olha, vamos deixar de lado essas manobras, Ministro Lewandowski Eu conheço muito bem o princípio do devido processo legal"
Deixar de lado," p 332),“significa não mencionar, deixar de dizer ou de fazer, deixar de lado, passar em silêncio ou em claro Nesta hipótese, o agente não se recusa diretamente nem intenta retardar a remessa dos elementos requisitados"
Deixar de lado," Debate Supremo Tribunal Federal Inteiro Teor do Acórdão - Página 342 de 375 16/02/2012PLENÁRIOAÇÃO DECLARATÓRIA DE CONSTITUCIONALIDADE 30 DISTRITO FEDERALDEBATEO SENHOR MINISTRO CEZAR PELUSO (PRESIDENTE) - Eu não vou antecipar o voto a respeito, mas só fazer uma ponderação Todas essas considerações de Vossas Excelências - como sempre muito respeitáveis e muito inteligentes - deixam de lado um problema que não pode ser considerado irrelevante: o problema da responsabilidade ética, que é o pressuposto da imputabilidade jurídica O Ministro Marco Aurélio usou expressão não jurídica para definir isso: ""Só se a pessoa fosse paranormal, ela teria alternativa de evitar o fato para, dali a alguns anos, não sofrer a restrição"""
Deixar de lado," O Código e o formalismo processual,Revista AJURIS 28/7)Justamente nessa linha é que esta Suprema Corte, em inúmeras situações – consideradas de “caráter excepcional” – deixou de lado a interpretação literal e estrita do art 535 do CPC, para o efeito de acolher embargos de declaração com efeitos infringentes, sempre que fosse necessário para corrigir equívocos relevantes no acórdão embargado"
Deixar de lado," O meu exemplo como magistrado de primeiro grau não foi um exemplo isolado Alguns outros casos realmente corroboram que, por vezes, a Administração Pública perde grandes valores, porque uma moça dessas, um rapaz desses, acaba saindo, deixando de lado sua aspiração pelo serviço público, para ir para o caminho da advocacia privada, que é muito melhor, é até mais rentável do que um concurso público Então perdemos, com isso, inúmeros valores, sem contar, como o próprio Ministro Barroso destacou, que a Constituição Federal é absolutamente omissa"
Deixar de lado,"526 / RS fevereiro Em lugar disso, a OTN foi valorada até NCz$ 6,92 (apenas 12,16%), na data da implantação do Plano Verão, deixando de lado o restante da inflação ocorrida3515"
Deixar de lado,"703 / MG Sanches) Se o princípio da anterioridade eleitoral é identificado pela mais recente jurisprudência do STF como uma garantia fundamental do devido processo legal eleitoral, sua interpretação deve deixar de lado considerações pragmáticas , no curso do pleito eleitoral, acabam por a apreciações subjetivas sobre a moralidade deste ou daquele candidato ou partido político 3"
Deixar de lado,"800O SENHOR MINISTRO MARCO AURÉLIO – Presidente, muito embora a nomenclatura da autuação seja AGREG no habeas, já o estamos julgando, porque, na sessão de 3 de abril de 2012, foi provido o agravo interposto contra a decisão da ministra Ellen Gracie, relatora origináriaPasso, então, ao voto no mérito, deixando de lado o resumo da espécieDocumento assinado digitalmente conforme MP n° 2"
Deixar de lado," Sem prejuízo das relevantes questões constitucionais levantadas em cada uma das manifestações precedentes, que podem se projetar para outros campos além do Direito Tributário, lembro que a litigiosidade aguerrida é um traço relativamente comum das demandas tributárias Nesse contexto, parece-me crucial deixar de lado as filigranas próprias da hermética legislação tributária para focar as ligações que o tema tem em relação aos valores fundamentais da ConstituiçãoDiscutimos se a legislação do IRPJ pode definir o momento no qual se considera que as empresas estrangeiras disponibilizam lucros às empresas coligadas ou controladoras domiciliadas no Brasil, independentemente da efetiva distribuição econômica ou da deliberação jurídica dos respectivos órgãos de gestão"
Descobrir a pólvora," Já julgamos inúmeros casos aqui e que entendemos que deveríamos prestar sua deferência ao Poder Legislativo, mas, aqui, é mais do que razoável e, no meu modo de ver, é absolutamente necessária a intervenção judicial nessa questãoO Ministro Gilmar não estava presente, mas tive a oportunidade de fazer um elogio ao seu voto veemente de ontem, e, dentro da nossa amistosidade, comentava com o Ministro Teori que o Ministro Gilmar, quando descobre a pólvora, faz uma bomba atômica, porque realmente fica convencido das suas razões, as quais foram muito bem-expostas, durante cinco horas, num voto verbal praticamente manifestando a sua convicção Então, só estou rememorando que é para a votação se fazer - digamos assim - com conhecimento dos pontos adversos, que fazem parte da convivência de um colegiado"
Fazer uma limpeza," Debate Supremo Tribunal Federal Inteiro Teor do Acórdão - Página 16 de 31 HC 105973 / RS matérias absolutamente pacificadas e muito numerosas no sistema Judiciário brasileiro, para que, enfim, se pudesse fazer uma limpeza do nosso sistema, e esses vasos comunicantes voltassem a funcionar O Senhor Ministro Ayres Britto (Relator) - Mas aí, Excelência, refiro-me ao Ministro Celso de Mello, especificamente, todo juízo, todo pensamento, todo enunciado que se vaze numa estrutura de linguagem, de linguagem vernacular, comporta interpretação"
Fechar os olhos,"Deve-se celebrar a resposta institucional dada ao episódio, como uma reação à aceitação social e à impunidade de condutas contrárias à ética e à legislação Mas não se deve fechar os olhos ao fato de que o chamado “Mensalão” não constituiu um evento isolado na vida nacional, quer do ponto de vista quantitativo (isto é, dos valores 3 Documento assinado digitalmente conforme MP n° 2200-2/2001 de 24/08/2001, que institui a Infraestrutura de Chaves Públicas Brasileira - ICP-Brasil"
Fechar os olhos,"Deve-se celebrar a resposta institucional dada ao episódio, como uma reação à aceitação social e à impunidade de condutas contrárias à ética e à legislação Mas não se deve fechar os olhos ao fato de que o chamado “Mensalão” não constituiu um evento isolado na vida nacional, quer do ponto de vista quantitativo (isto é, dos valores envolvidos) quer do ponto de vista qualitativo (da posição hierárquica das pessoas envolvidas) Justamente ao contrário, ele se insere em uma 3 Documento assinado digitalmente conforme MP n° 2"
Fechar os olhos,"Deve-se celebrar a resposta institucional dada ao episódio, como uma reação à aceitação social e à impunidade de condutas contrárias à ética e à legislação Mas não se deve fechar os olhos ao fato de que o chamado “Mensalão” não constituiu um evento isolado na vida nacional, quer do ponto de vista quantitativo (isto é, dos valores envolvidos) quer do ponto de vista qualitativo (da posição hierárquica das pessoas envolvidas) Justamente ao contrário, ele se insere em uma tradição lamentável, que vem de longe"
Fechar os olhos," No segundo, há crimes praticados em concurso de agentes, como é, data venia, a situação dos autos, na minha compreensão Não quero, em absoluto, fechar os olhos ao fato – destacado, inclusive, pelo eminente Relator - de que agentes podem se associar, originariamente, para fins lícitos e, em um dado momento, alterar a finalidade inicial da sua associação, dirigindo-a à prática reiterada de crimes Ainda, uma associação de pessoas pode ocorrer por finalidades várias, dentre elas a de cometer crimes, o que também configura o crime, agora denominado de associação criminosa"
Fechar os olhos,"Deve-se celebrar a resposta institucional dada ao episódio, como uma reação à aceitação social e à impunidade de condutas contrárias à ética e à legislação Mas não se deve fechar os olhos ao fato de que o chamado “Mensalão” não constituiu um evento isolado na vida nacional, quer do ponto de vista quantitativo (isto é, dos valores envolvidos) quer do ponto de vista qualitativo (da posição hierárquica das pessoas envolvidas) Justamente ao contrário, ele se insere em uma 3 Documento assinado digitalmente conforme MP n° 2"
Fechar os olhos,"671/08Portanto, os fatos apresentados a par da gravidade, são indicativos da extrema necessidade de se atuar no resguardo da política de segurança pública, para a qual, dado o interesse de toda a coletividade, não se pode fechar os olhos[…]"
Fechar os olhos," 57/60 do referido agravo, consta petição das contrarrazões do Ministério Público, onde é indicado como recorrente o corréu Rodrigo Burgel, que fora absolvido, e não o nome de Adriano de Oliveira Camargo, verdadeiro recorrente, o que levou ao não conhecimento do agravo de instrumento”  Dessa forma, embora o paciente não tenha esgotado os meios recursais cabíveis no Tribunal a quo, o que poderia ter evitado o trânsito em julgado da condenação sem a análise de mérito dos recursos interpostos, não se pode fechar os olhos para um equívoco tão evidente, 2 Supremo Tribunal FederalDocumento assinado digitalmente conforme MP n° 2200-2/2001 de 24/08/2001, que institui a Infraestrutura de Chaves Públicas Brasileira - ICP-Brasil"
Fechar os olhos,"O SENHOR MINISTRO DIAS TOFFOLI:Estou pensando aqui na racionalidade do sistema como um todoO SENHOR MINISTRO CEZAR PELUSO - O fato de sermos animados por esse ideal absoluto de segurança jurídica, no sentido de produzir uma decisão só, não pode fechar os olhos para casos concretos que podem ser diferentes Consagrar uma tese unitária para o mundo real que pode ser diferente implica  segurança jurídica em algum sentido, mas, a meu ver, é só segurança, não é jurídica, porque a segurança jurídica tem que estar ligada à certeza do Direito"
Fechar os olhos," E, com isso, inobservamos incompetência que não é relativa, não se prorrogando, incompetência que, em virtude de estar ligada à função, ao cargo, ao mandato, se mostra absoluta Mesmo assim, fechamos os olhos, dando um péssimo exemplo, fazendo-o em variação inconcebível, ante o precedente Cunha Lima Fechamos os olhos, ou melhor, fechamos a Carta da República e partimos para o julgamento"
Fechar os olhos," Presentes os requisitos de vida em comum, coabitação,  mútua  assistência,  é  de  se  concederem  os mesmos direitos e se imporem iguais obrigações a todos os idênticas características vínculos tenham afeto que de Enquanto  a  lei  não  acompanha  a  evolução  da sociedade,  a  mudança  de  mentalidade,  a  evolução  do conceito de moralidade, ninguém, muito menos os juízes, pode fechar os olhos a essas novas realidades Posturas preconceituosas  ou  discriminatórias  geram  grandes injustiças"
