Fechar os olhos,"▃▃▃▃▃▃▃▃▃▃▃▃ Bati a porta do banheiro com toda a força do mundo e a tranquei, me apoiei na pia e fechei os olhos com força, eu estava morrendo de raiva, abri meus olhos me deparando com a minha imagem no espelho que ali havia, eles estavam vermelhos, sinal de lágrimas de pura raiva vindo E então, desabei, comecei a chorar baixinho"
Fechar os olhos," ー Tô esperando ー Ele disse e eu fechei os olhos com a esperança de que quando eu abrisse fosse apenas um pesadelo Respirei fundo e levei minha mão esquerda ao seu membro que estava levemente duro, mas assim que eu encostei petrificou, segurei-o com força e fiz movimento de vai e vem, tomando coragem para colocar a boca, Payton se mantinha de pé em minha frente, enquanto eu estava sentada na ponta da cama \'\'acariciando\'\' seu pênis, apertei meio forte fazendo ele dar um trombada com a cabeça para trás"
Fechar os olhos," ー Esse choro só está piorando minha dor de cabeça ー Louis disse com fechando os olhos e fazendo uma cara de dor ー Se você não tivesse bebido, nada disso teria acontecido"
Fechar os olhos,"me: agr vamos para as fotos da hinatinhaa  hinata: e-eu mais oq tem de interesante em mim? me: nossa hinata para de se diminuir, parece eu  Sakura: aaahn q isso gnt hinata? hinata: pq eu to assim gnt? naruto: hinata eu achava q tu era um anjo sasuke: isso é pra qm? kurenai: hinata?! kiba: akamaru fecha os olhos! Neji: hinata putassa mlk n constumo ver ela assim n sakura: hinata fica gatona com batom vermelho  naruto: hinata mudo o corte de cabelo? hinata: gnt oq vai acontecer cmg  Sakura: wooou q linda vc hinata  hinata: isso é uma roupa de noiva? sakura: hinata vai se casar com qm? me: ahh vamos fingir q n sabemos com qm ela qr n é msm"
Fechar os olhos," Eu olho pra ela e sorrio - Senhora Beauchamp, em minha defesa eu só me levei pelo momento -diz rindo - Nunca em sã consciência eu ficaria com esse doido com asenhora por perto -exclama e eu a olho com hesitação - Sua fêmea caloteira! Você é doida pelo meu corpinho que eu sei bem, minha mãe que fez -passou a mão pelo meu abdômen e rio - Joshua Beauchamp você é um grande doido e eu não sou caloteira -menciona brava e logo cai na risada - Vocês são um casal tão fofo-Chloe diz rindo também e eu sorrio, já Any sorri fraco e diminue a risada e começa a comer O resto do almoço foi calado, Any não fez nenhum comentário e eu também não ia força-la Terminamos de comer e eu levo os pratos pra cozinha - Vamos subir? - questiono e ela concorda com a cabeça No meu quarto, ela senta e se conforta igual estávamos antes -Gaby? - Oi - vira pra mim -Tudo bem? Você ficou calada derrepente - Não é nada, só sono - fala e sorri fraco - Quer dormir? Eu deixo você encostar em mim, eu sou bem macio sabe-dou uma risadinha e ela revira os olhos, não evitando de sorrir A menina se encosta no meu peito e se cobre - Obrigada - diz devagar e logo fecha os olhos Eu aproveito e faço o mesmo - Obrigada você"
Fechar os olhos," Vou pro meu lugarzinho de paz, onde só eu e a Sina sabemos onde fica, ninguém vem aqui e isso é ótimo Coloco meus fones e fecho os olhos, preciso relaxar a minha mente um pouco Tudo tá acontecendo tão rápido, que eu não consigo acompanhar"
Fechar os olhos," E de novo, Any aparece no chão preto, mas dessa vez fico parado a observando -Lute Josh! Por favor, faça como ele disse: acorde! -ela fala com a voz fraca e fecha os olhos -De novo não Any! Por favor"
Fechar os olhos,"F omos para a sala de música eu me sentei na frente do piano e comecei a tocar minha música favorita \n \n \n \n \n \n \n \n  Ela fechou os olhos e escutou cada nota da melodia e eu não sei em que momento mais dei um sorriso, continuei tocando as músicas por uma hora e meia, quando terminei ela abre os olhos e com aqueles olhos inocentes me agradecendo, eu olhei mais fundo e fui me aproximando até não haver mais espaso entre mim e ela, colando nossos lábios e iniciando um beijo que assim como as notas músicas da primeira música que toquei para ela"
Fechar os olhos," Estou deitado na minha cama, Lina hoje foi para a casa do pai com as irmãs pois ele está doente e elas iram cuidar dele até que melhore, eu não sei mas, agora que me acostumei com Lina aqui é estranho dormir sem ela, mas tenho que descansarEu me deito e fechei os olhos, depois de um tempo eu acabei apagando, tudo estava escuro, até que eu me vejo em um lugar que eu conheço muito bem, é a minha casa, mas"
Fechar os olhos,"- Chuto de leve o sofá algumas vezes até ela acordar - Festa acabou querida,fora- Falo apontando para a porta -Não vou sair daqui - Ela fala fechando os olhos e meus nervos fervem,pego na sua blusa que está em cima dela e encho a mão com o seu cabelo castanho e a puxo fazendo ela gritar e levantar do sofá e eu atravesso a sala com ela gritando me chamando de nomes e abro a porta -Eu falei fora!- Falo e a jogo para fora do apartamento tacando a sua blusa em cima dela e fecho a porta a trancando"
Fechar os olhos," - Começo a rezar para mim mesma enquanto vou olhar debaixo da minha cama pois eu sabia que tinha algo lá, me debruço na cama me abaixando enquando falo o Pai Nosso,quando olho diretamente debaixo da cama vejo um ser de olhos vermelhos feito fogo com um sorriso maligno me fazendo gritar forte com todo ar dos meus pulmões  Caio da cama e escoro na parede gritando mais e mais quando eu vejo o ser preto vindo na minha direção e a única coisa que eu faço é gritar quando uma luz se expande no quarto me fazendo fechar os olhos com tamanho blilho,consigo abrir os olhos quando aquele ser preto é levado por uma luz fazendo a porta da sacada se abrir brutalmente fazendo um estrondo pela casa e eles cai lá em baixo corro até eles olhando para baixo não vejo nadaMAIS QUE PORRA QUE ACONTECEU AQUI?! -Mãe!Pai! - Grito eles que se passa alguns minutos eles correm até mim"
Fechar os olhos,- Ele fala e saiOlho para o meu anti-braço que ainda estava doendo e fecho os olhos esperando que a dor passe Se passa alguns minutos sinto uma sensação boa como um consolo e acabo por abrir os olhos olhando em volta e nada
Fechar os olhos,"agora a noite? Naquela hora meu mundo parou,fechei os olhos com força sentindo minhas lágrimas descendo ao ouvir as próximas palavras da minha mãe ""estou indo pro hospital agora"" Um aperto no meu coração me fazendo soluçar,afundei meu rosto chorando audivelmente"
Lavar as mãos,"Mas enfim,boa noite,obrigada pela a atenção Bebam água, lavem as mãos, durmam bem"
Lavar as mãos,lavem as mãos
Pesar na balança," A convicção virá, cedo ou tarde, pela força das coisas, e os mais incrédulos serão arrastados pela torrente Alguns partidários a mais, ou a menos, no momento, não pesam na balança Por isso, não vereis jamais zangar-me para conduzir às nossas idéias aqueles que têm tão boas razões como vós para delas se distanciarem"
Pesar na balança,", que se alinham sob sua bandeira, todos são pessoas às quais não se pode recusar uma certa dose de luz Não há sábios senão na ciência oficial e nos corpos constituídos? Do fato de o Espiritismo não ter ainda direito de cidadania na ciência oficial é motivo para condená-lo? Se a Ciência não tivesse jamais se enganado, aqui sua opinião poderia pesar na balança; infelizmente, a experiência prova o contrário Não foram rejeitadas como quimeras uma multidão de descobertas que, mais tarde, ilustraram a memória de seus autores? Não foi a um relatório de nosso primeiro corpo de sábios que deve a França ter sido privada da iniciativa do vapor? Quando Fulton veio ao campo de Bolonha apresentar seu sistema a Napoleão I, que o recomendou ao exame imediato do Instituto, este não concluiu que esse sistema era um sonho\impraticável\e não tinham tempo para com ele se ocupar? É preciso concluir que os membros do Instituto são ignorantes? Isso justifica os epítetos triviais, e de mau gosto, que certas pessoas se comprazem em lhes prodigalizar? Seguramente que não; não há pessoa sensata que não renda justiça ao seu eminente saber, embora reconhecendo que eles não são infalíveis e que, assim, seu julgamento não é o de última instância, sobretudo em fatos de idéias novas"
Pular a cerca,  — É isso que vamos ver agora\ — Davi pula a cerca do parque e vai proximo a um grande motor aquele deve ser o sistema central do parque De repente todas as luzes se acendem e alguns brinquedos começam a se mexer
Ver estrelas," Depois de comer fomos ver um museu o qual Manuel disse ser muito legal, havia vários projetos de física Um deles era pra ver estrelas, todas as constelações, lua e planetas, tudo como se realmente fosse o céu, foi definitivamente o meu preferido \ \ \ Shawn me ignorou o passeio inteiro, eu não sabia o porquê disso, será que ele tinha se arrependido? \ \ \ Era noite quando terminamos de ver o museu, todos cansados decidimos ir para casa, no carro Shawn nem se quer me olhou, fingiu que eu não estava ali, por mais que isso fosse esperado dele me incomodou"
Virar a página,"Agora eu sou de outro nível, só quero viver sorrindo, se você virou a página eu queimei o livro!!"
Abrir os olhos,"Você:pq fez aquilo?-o olhaBeto:pq te amo-diz te olhando mais logo volta a olha pra estradaVocê: me ama? Não parece-diz olhando pra frenteBeto:mai amo sim!-diz bravo e te olha vcs ficam em silencio por um bom tempo e ele continua correndo cm o carro dps de um bom tempo ele quase bate em um carroVocê:Beto cuidado pelo amor de Deus-diz assustadaBeto:cala a boca eu sei dirigi-diz te olhandoVocê:Beto olha pra frente pfv-ele continua te olhando-Beto a gente vai bate-ele olha pra frente e então um ônibus aparace na frente de vcs-BETO CUIDADOO-vc grita assusta e o carro bate no ônibus vc fica cheia de sangue no rosto, vc fica desacordada por alguns minutos ate q vc abre os olhos de vagar-ai q dor-diz tentando se mexe mais não consegue se mexeXxxx:moça vc ta bm?-diz um homem q tava na rua te olhandoVocê:to só ta doendo um pouco a minha barriga e num consigo me mexe direito-vc então ouve a voz de uma moçaXxxx-ele ta desmaiado-vc a olhaVocê:moço faz um favor pega meu celu aki no bolsoXxxx:pego-ele abre a porta do carro e pega o seu celu-aki moça-vc levanta o braço de vagar e pega o celuVocê:obrigada-vc vê o numero de Luan e liga pra ele pois sua mae não tinha telefone-ele num atende q saco-diz chorandoXxxxx: a ambulância chegou moça-vc olha pro lado e vê a ambulância"
Abrir os olhos,"- Escutei a voz dele me fazendo abri os olhos já com o sorriso em meus lábios olhei, me virei e corri até ele o abraçando, senti seus braços indo até minha cintura e me apertando, retribuindo meu abraço Mellany: Austin- Apertei ele mais forte Austin: Mellany Mellany: Por favor nunca mais se esqueça de mim  Austin: Eu não te esqueci, eu estou aqui não estou- Encerrou o abraço e me fitou Mellany: Uhum- Olhei atentamente pra ele Austin: Então eu cumpri minha promessa- Sorriu Alex: Carlos você vai deixar essa outra escolher com quem quer dormir, eu tenho que me aliviar e estou sem paciência  Carlos: Volte para o quarto Mellany  Mellany: Não- Abracei mais uma vez o Austin, como se ele fosse meu ponto de refugiu Alex: Eu paguei pra dormir com ela Carlos  Carlos: Mellany não me obrigue a te levar a força  Austin: Eu pago o dobro- Ele me apertou em seu braços Alex: O que? Austin: Eu pago o dobro para subir com a Mellany  Alex: Eu paguei primeiro, eu dei minha oferta primeiro, ela tem que dormir comigo primeiro"
Abrir os olhos," 🕑Horas depois🕒 Acordei com uma claridade batendo em meu rosto quase me deixando cega, abri os olhos vendo que só uma brecha do sol estava se exibindo e logo ele quis me acorda olhei para o lado e pude ver ele ali dormindo serenamente, seu cabelo bagunçando e seu rosto amassado o deixava parecendo um anjo, aproveitei que já estava acordada e fiquei olhando pra ele, pode parecer uma idiotice mais algo me atrai nele observada cada coisa nele até mesmo suas pintinhas espalhadas pelos seu rosto, fazendo ele ter uma cara angelical mais ao mesmo tempo seduzente, ele dormia esparramado na cama com uma perna tampada pelo coberto e a outra revelava sua coxa, sua perna e uma grande parte do seu bumbum que estava destacado ainda naquela cueca, voltei a olhar pra cima, quando comecei a alisar seus cabelos platinados mesmo dormindo ele parecia ter um grande poder sobre mim algo me ligava ao Austin e parecia ser uma ligação forte, vi seus olhos se abrindo lentamente e logo ele se mexendo, um sorriso brotou em seu rosto  Mellany: Foi mal não queria te acorda Austin: Não tem problema- Ele deu um sorriso fofo, já falei o quanto ele fica lindo assim, já neh, pois é ele fica lindo Mellany: É bom acorda e não tá em um lugar como aquele  Austin: E ainda tá deitada com um gostoso assim- Sua mão passou por seu abdômen Mellany: Convencido- Falei sorrindo- Mais algo para minha listinha Austin: Listinha?  Mel: É uma listinha das coisas que você é- Sorri Austin: E o que você já tem pra essa listinha?  Mellany: Coisas- Deixei sua pergunta no ar Austin: Ok"
Abrir os olhos,"Diferente dos beijos de Mellany eu já sentia outra coisa pela Emma, digamos que não era o mesmo de antes mais ainda sentia algo, mas no beijos de Mellany eu sentia trilhões de sentimentos indecifráveis, tinha desejo, tinha coisas que eu não sabia explicar, assim que finalizei o beijo me afastei da Emma dando um sorriso e abrindo os olhos, mas puta que me pariu que porra é isso, pisquei várias vezes  Austin: Mel?- Pisquei outra vez e apareceu o rosto da Emma Emma: Mel? Que Mel?- Sua voz saiu desconfiada Austin: Mel, eu preciso tomar mel, é isso- Me afastei dela e caminhei até a cozinha e percebi que ela vinha atrás de mim Emma: Pra que você vai tomar mel? Austin: Para de falar o nome mel- Aquilo tava me deixando nervoso Emma: Mas o que tem mel  Austin: Puta que pariu- Falei olhando os armários Emma: Austin você não tá bem  Austin: Mel? Cade o mel?  Emma: Não tem mais mel  Austin: Por que você não me avisou  Emma: Você não deixou  Austin: Eu vou sair- Falei caminhando até a sala pegando minhas Chaves e meu celular Emma: Onde você vai?  Austin: Atrás de Mel- Falei isso sem deixar ela responder e fui pra fora indo até a garagem"
Abrir os olhos,"Boa leitura🍂📖 Austin: O que foi mãe?- Perguntei já empurrando Emma para o outro lado da cama, e logo vestido minha cueca Claudia: A Mellany Austin, a Mellany- Simplesmente aquele nome fez todo meu sangue parar de circular, e meu coração parar de bater por um segundo, e naquele outro segundo já estava parando em frente à minha mãe Austin: O que tem ela mãe?- Não deixei ela me responder e corri até o quarto, onde assim que cheguei no seu quarto notei minha garota desacordada no chão Não esperei, corri até ela e me sentei no chão, onde coloquei sua cabeça deitada em meu colo, e logo minha mãe e Emma estavam paradas olhando tudo Austin: DROGA O QUE ACONTECEU COM ELA?- Gritei em busca de resposta Claudia: Não sei, eu vim ver ela e quando cheguei ela estava ai, e depois só corri até você- Não respondi nada  Apenas comecei a sacudi-la não muito forte enquanto a chamava diversas vezes Emma: Só frescura isso  Austin: VOCÊ CALA A SUA BOCA PORRA- Gritei mais uma vez, e o medo me consumia, minha garota estava em meus braços desacordada e ninguém sabia o motivo, e aquilo estava acabando comigo  Emma não falou mais nada e apenas saiu correndo para o quarto, continuei tentando com minha mãe acorda mellany MELLANY❤️ Sentia meu corpo pesado, tava tudo escuro mas algo me sacudia, escutava vozes vindo de fundo, lutei contra a minha vontade de abrir os olhos, e assim que fui abrindo devagar pude ver Claudia me chamando várias vezes  Claudia: Austin, Austin ela acordou- Sua voz chamava ele e logo ele surgiu do nosso lado Austin: Caralho, Vixi acordou, não faz mais isso comigo porra se não quem vai desmaiar sou eu caralho- Permanecia calada apenas observando tudo Claudia: Está ouvindo nós Mellany?- Claudia perguntou preocupada Mellany: Si"
Abrir os olhos,"  - Até parece que não tem como não sentir esse seu olhar em cima de mim, além do mais seu perfume é insuportavelmente doce - Ele abre os olhos e se senta no sofá  - Oh me desculpe, e meu perfume não é tão doce"
Abrir os olhos,  Abro os olhos e vejo o trem passando atrás da gente  - Viu não morremos !!! - Falo fazendo ele abrir os olhos  - Sua louca!! Maluca!! Irresponsável você
Abrir os olhos,  — Justin?!\  — Hm?\ — ele resmunga de olhos fechados  — Poderia me ajudar?\  — Quais palavrinhas mágicas?\ — ele abre os olhos e se senta como índio  — Poderia
Abrir os olhos,"Sinto uma mão na minha testa, mas o estranho que eu não consigo abrir os olhos e não consigo me mexer O que há comigo? Ouço o que as pessoas estão falando, mas não consigo acordar, é como se eu tivesse morta e a minha alma tivesse aqui, não a minha vida"
Abrir os olhos,"  -Pode admirar, pra você é de graça- Brinca abrindo os olhos  Dou uma leve risada, e ele passa polegar em meus lábios"
Abrir os olhos," Subir para o meu quarto e fui descansar um pouco, e quando eu pensava esta finalmente em paz fui despertada por um pesadelo, ao qual me assustou bastante, e me deixou aterrorizada 💭💭\ Estava eu sentada no banco da igreja em que eu frequentava, e lá estava o coral cantando àquela música da harpa: "" Por que ele vive"" então, eu Fechei os olhos e começei a cantar junto com eles, porém quando eu abri os olhos e olhei para o coral, do nada tudo começou a escurecer e uma voz, a mesma voz que ecoava dentro de mim ontem, começou a falar fortemente:- Você não merece esta aqui, aqui não é o seu lugar haha! - Então quando me dei conta, estava sendo arrastada por vários bichos que pareciam mais com pessoas, e na proporção em que eu sendo puxada o coral cantava mais forte e eu conseguia me soltar deles \\ E quando eu pensava que finalmente estava livre, começei a sentir fortes dores de parto, porém me recordei que eu não estava pronta para ter a criança pois não tinha nada ainda, então mesmo com fortes dores corri para casa para tentar arranja alguma coisa para minha filha que estava prestes a nascer, porém ao chegar em casa vi uma grande multidão na sala e eu sem entender nada me aproximei e vi um caixão no meio, e ao lado dele vi meus amigos chorando à bessa, então eu me desperei e ao me aproximar mais ainda vi uma pessoa dentro do caixão porém antes mesmo de ver quem era eu despertei"
Abrir os olhos, — Tocou o seu pescoço e beijou o seu queixo\\\ Linda abriu os olhos e sorriu para Matthew O inglês tinha a certeza que nunca tinha visto um sorriso mais bonito na sua vida
Abrir os olhos, — Humm!\\\ — Matthew!\\\ — O quê?\\\ — Aconteceu alguma coisa\\\ Matthew abriu os olhos imediatamente — Como assim?\\\ — O navio
Abrir os olhos,"\\\ E então, alguém bateu na porta\\\ Matthew abriu os olhos e levantou com cuidado para não acordar Linda Vestiu suas roupas imediatamente e abriu a porta, torcendo que não fossem seus pais"
Abrir os olhos," Ainda tinha esperança, coisa que muitos dos passageiros já tinham perdido naquele momento\\\ A jovem irlandesa sentiu seu corpo voar por alguns segundos, e sem coragem de abrir os olhos gritou até que seu bateu contra o corpo de alguém Sua mão ainda presa na de Matthew, seu corpo ainda tremia e seus olhos ainda fechados"
Abrir os olhos," Pode ser o que for, você vai gostar *Deixe um pequeno trecho de uma de suas obras para nos instigar: ""Raymond Ernest abriu os olhos, e a primeira coisa que viu fora a imagem turva e fragmentada de seus próprios pés flutuando em meio ao cenário escuro e frio no qual se encontrava Sentiu seu corpo congelar gradualmente e os ouvidos zumbir com o som abafado das hélices e do motor no navio; viu caixas grandes e de madeira afundar à sua volta, todas indo em direção ao fundo do mar, seguindo o completo esquecimento"
Abrir os olhos," \ \ \ \ \ \ \ \ \ \\ (Quebra de tempo) \\ S/N estava dormindo tranquilamente,até sentir lábios tocarem os seusQuando ela abre os olhos,ela vê PedroEla retribui o beijo,que vai ficando intenso a cada segundo"
Abrir os olhos, — Já dormindo! Era Camargo Helena abriu os olhos sobressaltada A voz de Camargo produzira-lhe a impressão de desagrado que lhe fazia sempre
Abrir os olhos," - Sério, Taehyungie ? - Ele diz em um tom de decepção - Bom, podemos fazer algo mais fácil ainda - Tipo o que? - Pergunto abrindo os olhos - O quão longe você chegou com Yoongi? Tipo, o que vocês fizeram de romântico, ou algo do tipo? - Esses dias eu fui pra casa do Yoongi e eu fiz carinho em sua bochecha, enquanto estávamos deitados em sua cama"
Abrir os olhos," - Ele diz baixo, abrindo os olhos devagar - O que houve? - Nada - Digo sorrindo e me acomodando em seu ombro"
Abrir os olhos," - Ele abre os olhos devagar - Oi, Gi - O-oi"
Abrir os olhos,Taehyung Eu senti uma dor forte na cabeça Eu abri os olhos e só vi o branco Eu estava deitado em uma maca na sala de um hospital
Abrir os olhos," Estica a mão e acaricia o meu rosto de forma delicada, fecho meus olhos e sinto a sua presença por completo \ \ \\ - Amélia- abro os olhos - posso te beijar?- ele me pergunta cheio de desejo \ \ \ \ Não respondo, ao invez disso chego mais perto e selo nossos lábios, um beijo doce e calmo, ele me puxa para mais perto e eu aprofundo o beijo"
Abrir os olhos,"Acordo com dificuldade de abrir os olhos por conta da claridade, estendo a mão pra ver se Shawn estava ali mas ele não estava, aos poucos vou me acostumando e vou abrindo os olhos Olho para o lado e lá estava uma roupa pra eu usar, não era minha e também não era dele mas cabe certinho em mim"
Abrir os olhos," — Minha gripe está piorando né – falava tentando abrir os olhos, com a voz fanha — E você ainda molhou o cabelo, maluca? Vai piorar cada vez mais"
Abrir os olhos," -ela parece ter escutando e não ligado -Não estou te impedindo Josh, vaza e me deixa dormir -eu rio -Na verdade está sim, abre os olhos dorminhoca -digo divertido e ela parece não entender, logo abrindo os olhos e arregalando-os, se soltando rápido e sentando na cama -Meu deus! -exclama com vergonha -Mil perdões! É"
Abrir os olhos," -ANY! ANYYYYY! FICA COMIGO! Sinto meu corpo contorcer, mas não o corpo daqui, i corpo de fora  Faço o possível para tentar abrir os olhos, e ver Any me esperando -ANY! ANY! POR FAVOR! -minha voz grita do lado de fora"
Abrir os olhos," Ele estava com muito medo de algo acontecer com você quando ele não estava lá, incapaz de protegê-lá Ele teve que ficar do seu lado, com a mão dele na sua enquanto você se acordava, ainda meio zonza devido a operação  - Sn - Shaun disse assim que você abriu os olhos  - Shaun - Você questionou piscando para limpar a visão embaçada - Você está acordada - Apontou Shaun, levantando-se, mais ainda mantendo a mão trancada na sua  Você apertou a mão dele, sorrindo para ele enquanto o puxava para beija-lo suavemente Shaun relaxou quando você o abraçou, movando suavemente a mão para cima e para baixo nas costas dele enquanto o abraçava  - Estou tão feliz que você esteja bem"
Abrir os olhos," Você não tinha mais vinte anos e não podia se curar tão facilmente como antes  - O que? - Jason parou no meio do ponto para olhar pra você -Querida, do que está falando? - Jason perguntou Ele voltou a terminar seus pontos, se você queria ter uma conversa seria, então ele não queria que você sangrasse no balcão do banheiro  - Você sempre amou estar lá fora  - Eu quero ter uma família com você, Jay - Você finalmente abriu os olhos novamente para olhar sua reação Nenhum de vocês já falou sobre querer ter filhos"
Abrir os olhos," Você abriu os olhos, começando a sentir-se ansiosa As luzes estavam apagadas e o quarto estava meio escuro, mas não demoraria muito pra ele ver  - Tommy - Você sussurrou\  - Diga-me querida - Ele beijou suavemente seus lábios - Alguma coisa está incomodando você? Você parece"
Abrir os olhos," Esquisito Você abriu os olhos para encontrar os penetrantes olhos azuis do Superman - Você está bem? Você voltou a sua inconsciência antes de poder responder a ele  - Você a pegou? - Superman ouviu Batman dizer Superman voou ao lugar escondido na torre da LexCorp e Batman apenas olhou sua figura nos braços de Superman  - Leve-a para o hospital - Batman se pronunciou novamente  Superman levou você para um dos hospitais, contando o que tinha acontecido"
Abrir os olhos," Ele notou suas respirações superficiais e segurou sua bochecha com a mão, a acariciando lentamente com o polegar Você fechou os olhos e se inclinou para o toque dele  - Sinto muito - Ele susurou  Quando você abriu os olhos, ele estava mais perto de você Você inclinou a cabeça e os lábios dele encontraram os seus"
Abrir os olhos," Você fechou os olhos e esperou pelos lábios dele, mas de repente sentiu a cama se mover debaixo de você Quando você abriu os olhos, você o encontrou pulando loucamente com um grande sorriso no rosto  Segundos depois, você não resistiu e começou a pular também Vocês dois estavam uma bagunça, rindo enquanto constantemente se chocavam ou tentavam topar um no outro  Depois de um tempo, vocês dois deitaram na cama, ombro a ombro quase sem fôlego  - Você tá nervoso? - você perguntou, quebrando o silêncio  - Meio que"
Abrir os olhos," No que pareceu trinta segundos, o sinal tocou e todos começaram a entrar em suas salas Você abre os olhos e levanta a cabeça de Peter Peter gemeu baixinho  - Vamos ficar aqui um pouco mais - implorou Peter desesperadamente - eu quero ficar com você só mais um pouco antes de irmos  - Peter eu não posso-"
