Encher o saco," -O que foi isso? -eu digo rindo e ele sorri abertamente -Ninguem merece, muito menos você, desculpa ela ficar te enchendo o saco -Tudo bem"
Encher o saco," Eu fui mandar mensagem para ela Chat with Any✨ Oi, porque não me avisou que não viria pra escola hoje? Pq não te interessa????? Para Allycia, a gnt já passou dessa fase vai Cala a boca Joshua Não fui porque não quis, aliás eu pedi pra Sina te avisar, ela não te disse nada? Disse, mas eu não quis acreditar que vc perdeu essa chance de ver meu rostinho lindo Se manca daqui e vai prestar atenção na aula otário kkkk Por você eu vou! Deixa eu perguntar, a festa ainda estou de pé né? Não sei, depende do meu humor ou o quanto eu vou aguentar a Sina me enchendo o saco depois As vezes eu acho que você da essas desculpas só pra não dizer que não quer me ver Olha!! Você descobriu o meu segredo! te vejo na festa mais tarde, tchau e não me enche mais o saco!!!! tchau esquentadinha, eu e\ Noah passamos ai as 19:00 chat off Desligo o celular e vou prestar atenção na aula, eu realmente gostava de matemática Estava ansioso pra essa festa"
Encher o saco,"\ \ \ \ \ \ \\ HINATA Kakashi deu a aula de história,e agente ficou conversando depois veio a kurenai que deu artes pra gente todas TODAS as meninas tavão escutando música mas a professora nem percebeu NARUTO Eu estava desenhando(aut:claro é aula de artes)em fim tava de boa quando ousso uma voz muito irritante Shion:oii narutinho  Naruto:o que vc quer criatura vc só me enche o saco Hinata:kkk se-fudeu Shion:cala a boca que a conversa não chegou no galinheiro Todos:oooouuuu Hinata:claro vc ta na conversa então ta no lago onde as piranhas ficão a e não é la que vc mora Todos:ooouuu Shion ia bater na Hinata mas a Hina segurou e as amigas delastentou ajudar a Shion mas as meninas entrarão na frente QUE BARRACO!! Hinata:aa que foi Shion precisa das suas amigas pra se-defender não consegue sozinha (ironica) A Temari estava na frente da Tayuga, Sakura estava na frente da Karin,tenten estava na frente(MERDA esqueci os nomes/ten:vc se esquece de tudo é nois kk)em fim tava todo mundo olhando e a prof SEI LÁ AONDE TA  A Shion se-soutou e disse:eu sei me virar muito bem-nesse estante a Hinata socou SOCOU a Shion todos ficarão de boca aberta menos as meninas  Meninas:SE MECHER COM UMA DE NOS MECHEU COM TODAS SUAS VADIAS!!-as ""vadias"" kk forão bater nelas so que elas segurarão as mãos das ""vadias""e SOCARÃO éee elas não dão tapas elas SOCÃO Meninos:kkk bem feito  As vadias se-soutarão e foi em bora kkk essas meninas vão causar elas se sentarão e eu e os meninos olhamos elas surpresos pela TRETA delas  Meninas:QUE FOI PERDEU O CU NA MINHA CARA!!!?? Meninos:calma!! Hinata:odeio aquelas vadias Sakura:somos duas Temari:tres Ino:quatro Tenten:cinco Hanabi:aaaa pq eu tive que ficar por ultimo Konohamaru:pq vc não falou antes(ironico) Hanabi:FALOU O OBIVIO Sai:nossa vcs só sabem brigar Ino:cala a boca o ALBINO Tenten:iiii que casal lindo Sakura:pior-as meninas se olharão menos a Ino-SAINO Neji:kkk pior kk"
Entrar pela janela," - Podemos continuar o que começamos? Não pensei duas vezes me joguei em seus braços, estávamos ali juntos meu corpo junto ao dele, estávamos tão perto, seu corpo estava tão próximo ao meu, foi a melhor noite da minha vida, não acredito que precisei esperar 10 anos, ele foi gentil e delicado e foi maravilhoso, nunca me senti tão viva e tão amada Acordei com os primeiros raios de sol que entravam pela janela, ele estava acordado - Você é ainda mais linda com a luz da manhã sabia? - Faz tempo que acordou? - Tem um tempo, sou um homem do campo, acordo antes do por do sol, mas não queria te acordar e não queria que saísse dos meus braços"
Entrar pela janela," - Podemos continuar o que começamos? Ela pulou em braços como costumava fazer antigamente, prendendo as pernas sobre a minha cintura, seria nossa primeira vez juntos e foi a primeira dela, fui o mais gentil e carinhoso possível e foi a noite mais linda de toda a minha vida, porque foi amor de verdade Acordei antes de amanhacer, havia muito trabalho a ser feito na fazenda, mas iria esperar eu não iria sair dali, ter ela assim dormindo tranquila em meus braços, os primeiros raios de sol que entravam pela janela, enaltecia ainda mais seus cabelos dourados e a pele branca, ela acordou - Você é ainda mais linda com a luz da manhã sabia? - Faz tempo que acordou? - Tem um tempo, sou um homem do campo, acordo antes do por do sol, mas não queria te acordar e não queria que saísse dos meus braços"
Esfregar na cara,"MINHA VIDA É UM LIXO MAS A SORTE BATEU NA MINHA PORTA HOJE  Adivinhem quem me seguiu ? Swift_is_bae,Catlarrie,a senpai me seguiu(lupbits),a Naty me seguiu (larrystragada),Biscoitin_do_kook (rainha dona do meu cu) GENTE VOCÊS NAO TEM NOÇAO DE COMO EU TO FELIZ\  Serião,esfreguei na cara das inimigas  EU NÃO TO BEM JESUS ME SEGURA  É isso *luazinha* eu estava no meu lindo tédio e resolvi compartilhar com algumas pessoas  SE NINGUEM LER,FODA-SE :-)"
Fechar as portas," Mas mesmo um banco que esteja em boas condições em termos de renda pode passar por sérias dificuldades se, por qualquer motivo, seus depositantes vierem a perder a confiança nele e subitamente exigirem em massa a devolução de seus depósitos Inúmeros bancos sólidos foram forçados a fechar as portas devido a corridas desse tipo durante a crise de liquidez descrita no capítulo anterior Os dois problemas não são evidentemente independentes"
Fechar as portas," — Essa é a árvore celestial, Ela protege todos os humanosFazendo a ligação entre o céu e o inferno, ela é o que nos deixa vivos, uma vez que o coração é quebrado ele fecha as portas da árvore é apenas alguém com um poder muito alto pode fazer a árvore reviver, porém dizem que essa pessoa ficaria presa, por ser um dos pecados, ela apenas cuidaria da árvore com seu espíritoMas são apenas lendas"
Ir longe," Por um mal e longo tempo passei sentada naquele banco do carro, pela janela podia ver que era longe o lugar, pois o céu já avisava que era de noite, a velocidade foi diminuindo e logo o carro foi parado em um lugar onde era fácil de ver que não era algo que eu mais temia, a porta do carro foi aberta e fui puxada fortemente para fora do carro Carlos: Gostou doce mel?- Sua voz grossa falou em meu ouvido,  Olhei para cima e pude confirmar que era uma boate, onde seu nome era ""lust"" Carlos: É alemão, e sabe o que quer dizer ? Mellany: Lu"
Ir longe,  Rebola Jm: jungkook isso ta indo longe de mais Jk: só ta nois dois aqui jimim oq vc tem medo ? Jm: aff jungkook eu-eu 
Ir longe," P: Mariana, você se considera uma escritora de sucesso? Olha, eu não tenho a síndrome ""ain eu sou ruim e ninguém vai me ler"", tenho a síndrome ""não sou perfeita, mas posso melhorar"" então, sim, só pela boa vontade e confiança, me considero uma escritora de sucesso  P: Na sua opinião o que não pode faltar em uma história? Não pode faltar a paixão do escritor quando ele escreve aquilo, pq se você tá arrastando uma determinada história nas costas, ela não vai a lugar nenhum, e eu acredito que tudo que você faz com paixão, vai longe Uma história pra me prender tem que ter mistério, tem que ter uma dose de loucura, uma pitada de algo irreal"
Ir longe, \\ - Por que não vem mais vezes?- pergunto \ \ - Por que moro no Canadá e é longe?- ele me encara indignado \\ - Faz sentido - rio pela minha burrice
Ir longe," \ \ \ - Nem pense em infernizar a minha vida mais do que você já fez Se quiser ser cadela vai lá, mas que seja longe de mim \ \ \ Ela agarra meu cabelo e puxa minha cabeça pra trás, acaba ficando difícil de respirar"
Ir longe," Estava tocando Tourist e eu amo essa música de paixão  \ \ \\ Olho as paisagens na janela e há cada vista linda, levamos um tempo até chegar no lugar, era longe e lindo demais \ \ \\ Tinha cara de ser muito caro, obviamente"
Ir longe,"7 Cada um de nós é \rprodutor e também consumidor \r116 ? so\'u^° CO3Teta para estes problemas é abandonar o licenciamento Ao \rcontrário, ele acha wnbora o licenciamento tenha ido longe demais, há funções \rreais que ele pode e deve desenvol-ele reformas e alterações que en sua\ropinião, \rlimitariam os abusos observados no licencia- \r•- P- 121-- P- 146"
Ir longe," Ele imaginou que você não poderia ter saído por mais de dez minutos Ele passou as pernas para o lado da cama, levantou-se e imediatamente começou a procurar por você  Você não poderia ter ido longe, mas como seu noivo e o pai de seu filho ainda não nascido, ele achou necessário encontrá-la o mais rápido possível Não era incomum que, no meio da noite, quando você não se sentisse a vontade, o beijasse o acordando e pedisse que ele se juntasse a você a um passeio por dentro da mala, para o qual, é claro, ele nunca recusou"
Ir longe," (Não contém erros ortográficos e tem conteúdo adulto) Livro 3 da série: ""Fix Us [concluído]"" Os erros cometidos por Lionel James ainda na adolescência implicaram na sua decisão de recomecar sua vida longe de Charleston A distância imposta entre Lionel e Kendra os fizeram amadurecer muito Dois anos depois das mágoas e decepções, eles seguiram a vida deles da forma que puderam, e Luke James - o filho deles - se tornou a única lembrança que restou da família um dia sonhada"
Ir longe,":  eu queria te ver, sabe? tipo, finalmente te ver mas não como jeon jungkook, o cantor, e sim como a pessoa que sou longe dos holofotes  jungkook"
Ir longe," Depois que eu conheci Louis tudo virou do avesso, tudo mesmoA escola era longe, realmente longe, só de carro dava uns 30 minutos, imagina se eu pegasse um ônibus, chegaria lá em minha formatura Comecei a caminhar pela rua, pensando numa possibilidade de ir para aquela joça, óbvio que eu ia ter que ir até o apartamento de Louis e talvez pegar uma carona com ele, era o jeito"
Ir longe," Entrei no banheiro e Ian ficou do lado de fora me esperando, isso porque eu pedi, se não ele iria entrar junto A primeira coisa que fiz foi me olhar no espelho, meus olhos estavam inchados de tanto chorar, eu havia sido aceita em uma das melhores universidades do Canadá e não iria poder cursá-la, sem contar que eu estava sem a pessoa que eu mais amava no mundo e ficaria longe da minha melhor amiga, meu futuro nem começara e já fora destruído Tudo o que eu consegui fazer perante à todos aqueles pensamentos foi me apoiar na pia do banheiro e começar à chorar novamente"
Ir longe," ー Falei no mesmo tom autoritário de Partridge ー Louis, eu estava pensando, ele só queria me proteger, eu sei que ele foi longe demais, mas eu sempre tive do bom e do melhor, ele nunca deixou me faltar nada, eu tenho que prestar atenção nessas coisas também ー Você não vai, s/n"
Ir longe," PÁ!? Mas eu concegui fujir Neji:kkk se fudeeeuu Tenten:AA MAIS EU AINDA TE PEGO! Neji:NÃO VAI NÃOOOO Tenten:AINDA VOU TE PEGUAR  Nesse hora o Preguiça,Baka2 e o Trevooso me pucharão mas veio uma bomba na nossa direção agente foi longe kkk Sai Aaaa mas que saco a Ino desapareceu tou ouvino socorro bombas e MUITAS BOMBAS kk  Sai:aaaa mais que tedio Ino:aeee vc ta intediado então vamos esplodir alguma coisa kakaka( risada maliguina )  Sai:QUEM FALOU ISSO!?  Nesaa hora veio uma bomba enorme sai correndo pedindo socorro Sai:SOCORRO SOCORROOOO Neji:gente é o sai  Sasuke:ele ta pedindo socorro Konohamaru:ta naquela direção o sai Shikamaru:e foi dela que saiu a bomba enorme  Meninos:SAI ESTAMOS INDOOO"
Mostrar os dentes," Mellany: O que aconteceu? Resolveu fazer maratona de terno?- Falei zoando ele Arthur: Sem zoação Mellany- Falou tentando respirar fundo Mellany: Então que hora o casamento acontece? Dez da noite, onze horas?  Arthur: Daqui a dez minutos  Mellany: O QUE?- Gritei dando um pulo do sofá Arthur: Só consegui descobrir agora, vamos Mellany você está atrasada e daqui até lá são exatamente 10 minutos- Arthur me apressou Apenas calcei minhas sapatilhas e quando olhei ele já estava fora do quarto, acompanhei ele correndo até o elevador Mellany: Vamos droga- Falei enquanto chamava o elevador e assim que ele abriu corremos para dentro implorando para que ele descesse rápido para o terrio Assim que chegamos no saguão do hotel corremos rápido para fora logo entrando no carro Arthur: Está tudo bem?- Falou enquanto ligava o carro Mellany: Não droga, o homem da minha vida vai se casar daqui a 10 minutos e eu não chegarei a tempo Arthur: Relaxa você vai conseguir- Falou Arthur pisando fundo no acelerador e correndo o mais que podia \ \ \ \\  \ \ \ \  AUSTIN♡* Claudia: Você está lindo meu filho- Falou minha mãe assim que entrou no meu quarto, já havia colocado meu terno e me encarava na frente do espelho Austin: Obrigado mãe- Dei um sorriso amarelo sem mostrar os dentes Claudia: Eu só queria ver um sorriso ai- Falou minha mãe se aproximando de mim e me virando de frente para ela logo começando a arrumar minha gravata Austin: Talvez eu de um sorriso quando tudo isso passar Claudia: Quem sabe não é mesmo- Ela deu um meio sorriso- Mas agora temos que ir- Concordei balançado a cabeça e nós dois caminhamos até a porta e assim que saímos já vi meu pai encostado no carro Adam: Que orgulho, meu garoto vai se casar- Falou ele sorrindo- Vamos, porque na lei quem se atrasa é a noiva e não o noivo- Não falei nada apenas entrei no carro e fiquei quieto durante todo caminho até a igreja Assim que chegamos já havia uma grande parte dos convidado dentro da igreja entrei e caminhei até o altar onde o padre já estava esperando para a cerimônia  Padre: Ansioso meu filho?- Falou tentando puxar assunto Austin: Acho que sim padre- Meus pais caminharam até o lugar deles e logo vi os pais da Emma entrando e ficando em seu lugar À portas enorme de madeira da igreja se fecharam e já podia esperar o que estava por vim \ \ \ \ \  MELLANY❤* Brincava com os meus dedos enquanto batia o pé no carro tentando conter meu nervosismo Arthur: Porra Mellany se controla Mellany: Cala a boca- Foi a única coisa que falei  E logo ele seguiu a caminho Mellany: Puta que pariu- Falei assim que vi o engarrafamento- Merda o que vamos fazer? Não vai ter como sair daqui, isso vai demorar horas  Arthur: E agora Mellany? Mellany: Arthur faz alguma coisa- Gritei dentro do carro destravando meu cinto Arthur: Não a nada mais a fazer Mellany  Mellany: Quantos minutos falta?- Perguntei a ele Arthur: Cinco minutos Mellany: Droga- Falei olhando para frente- E se eu for a pé Arthur: Impossível, ce vai chegar na hora da festa e ele já vai ter casado Continuei batendo o pé e depois que se passou dois minutos abri a porta do carro Arthur: Onde vai sua maluca? Mellany: Impedir que o homem que eu amo se case com outra- Falei batendo a porta do carro e aproveitei que os carros estava parado e segui caminhando pela pista Assim que caminhei minhas pernas já estavam doendo e eu estava preste a desistir quando eu vi o sinal ficar vermelho e um motoqueiro parar  E bom"
Mostrar os dentes, -Q susto! Bom Dia - sem amostra os dentes - E ai ta gostando da faculdade? - Pergunta ela com um sorriso largo e esbanjado
Mostrar os dentes,"Oi gente sumida comovocês estão?? Espero que estejam bem😃😃 comentem bastante hoje ______________________________________________________Shiv: a semana passou voando e hoje último dia sim a Maya tô nada Bay chega beijando meu pescoçoBay- amorzinhoHum Bay- vamos brincar um pouquinho??( Me viro para ele fala) Tipo o quê?? Amorzinho?Bay- isso (N/A você já estava ficando né não deixa eles as sos) Shiv: eu tenho uma semana que a Maia chegou do acampamento e esses dias eu estou muito enjoada decidir fazer um teste de gravidez não sei o que devo vou falar com que eu estou grávida e deu positivo Nenê , posso te contar uma coisa?Bay- Claro que não o que você tem para contar?! Eu tô grávida ( falou sorrindo sem mostrar os dentes) Bay- sério?(pergunta com os olhos lagrimando) Sério (o repito) vamos conta pra Maya ?Bay- vamosChegando no quarto da MayaFilha eu e seu pai tenho que cantar uma coisa para você, eu tô grávidaMaya-sério eu vou ter um irmãozinho ou irmãzinha? Shivley- sim!  Bailey may✓ Curtir um pouco loud Babi Noah urrea e outras 400mil pessoas Legenda: que venha com saúde!Comentários dessa publicação foram desativado Bailey may Shivani paliwal✓ Curtidos pó Noah urrea e Josh Beauchamp e outras 500 mil pessoasLegenda: happy birthday beautiful brothers in the world love you Josh Beauchamp e Noah urrea não marcaram nessAny Gabrielly: lindos os amores da minha vida Sina sininho: lindas principalmente de olhos verdes! E outras 300 mil pessoas______________________________________________________Oi gente estou sumida mas estou de volta para ficar mas de muitos dia sem postar mas hoje eu vou postar mais hoje de noite não esqueça de deixar as estrela e comenta bastante"
Mostrar os dentes,"vamos logo!-ele diz,se levantando\\ S/N abraça Rodrigo do jeito mais fofo,fazendo ele sorrir sem mostrar os dentesE assim foi,S/N foi puxando Rodrigo que nem uma criança quando quer mostrar algo importante aos seus pais"
Mostrar os dentes," -Ei, não precisa ficar nervosa, nós agimos como casal e acabou, é só você abaixar um pouco a guarda pra eu poder parecer o namorado perfeito -ele fala rindo e eu sorrio sem mostrar os dentes -Tudo bem, acho que vai dar certo"
Mostrar os dentes," -ele se embola em suas próprias palavras -vendo se a Any está com a sombrancelha bem feita -responde respirando afobado e sua irmã solta uma risadinha, a essa altura Any já estava vermelha de vergonha e segurando o riso -Só vim perguntar se vocês gostariam de uns salgadinhos em quanto eu e a mamãe arrumamos o almoço, devia ter batido antes Perdão -diz agoniada -Pode ser, obrigado-Josh concorda e Any sorri fraco e sem mostrar os dentes Sua irmã sai do quarto e o clima do quarto fica tenso -Então -ele suspira tentando acabar com a tensão presente -O que acabou de acontecer mesmo? -Joshua -diz resmungando e passando a mão na cabeça-você poderia ter me jogado com menos força sabia? Eu tomei um puta susto e você ainda me joga pro outro lado do quarto seu idiota! -exclama se ajeitando na cama e choramingando -Desculpa, meu coração foi a mil e foi a primeira coisa que se passou na minha cabeça -ela soca seu braço -Ouch não precisava -diz passando a mão no seu braço e resmungando -Você é um besta -ela fala rindo e ele começa a rir também -Nunca fui pego pela minha irmã e nem minha mãe em nada, parabéns por essa conquista na vida de Chloe Beauchamp! -comenta gargalhando e colocando friends pra passar Eles se ajeitam na cama e se cobrem, como se nada tivesse acontecido Mas no fundo estavam pensando nisso—————————————Curtinho, mas é isso"
Mostrar os dentes," -Ei, não precisa ficar nervosa, nós agimos como casal e acabou, é só você abaixar um pouco a guarda pra eu poder parecer o namorado perfeito -ele fala rindo e eu sorrio sem mostrar os dentes -Tudo bem, acho que vai dar certo"
Mostrar os dentes," -ele se embola em suas próprias palavras -vendo se a Any está com a sombrancelha bem feita -responde respirando afobado e sua irmã solta uma risadinha, a essa altura Any já estava vermelha de vergonha e segurando o riso -Só vim perguntar se vocês gostariam de uns salgadinhos em quanto eu e a mamãe arrumamos o almoço, devia ter batido antes Perdão -diz agoniada -Pode ser, obrigado-Josh concorda e Any sorri fraco e sem mostrar os dentes Sua irmã sai do quarto e o clima do quarto fica tenso -Então -ele suspira tentando acabar com a tensão presente -O que acabou de acontecer mesmo? -Joshua -diz resmungando e passando a mão na cabeça-você poderia ter me jogado com menos força sabia? Eu tomei um puta susto e você ainda me joga pro outro lado do quarto seu idiota! -exclama se ajeitando na cama e choramingando -Desculpa, meu coração foi a mil e foi a primeira coisa que se passou na minha cabeça -ela soca seu braço -Ouch não precisava -diz passando a mão no seu braço e resmungando -Você é um besta -ela fala rindo e ele começa a rir também -Nunca fui pego pela minha irmã e nem minha mãe em nada, parabéns por essa conquista na vida de Chloe Beauchamp! -comenta gargalhando e colocando friends pra passar Eles se ajeitam na cama e se cobrem, como se nada tivesse acontecido Mas no fundo estavam pensando nisso—————————————Curtinho, mas é isso"
Mostrar os dentes," R- Vamos levante-se, que tal uma partida de xadrez? O- Adorarei fazer-lo perder Ela me com um sorriso sem amostrar os dentes,fomos para a mesa, ela quis as peças pretas e eu fiquei com as brancas, eu olhei para ela que pensava em qual peça jogava após eu ter capturado seu bispo e ela ter capturado minha rainha Ela moveu sua torre para o lado deixando meu rei sem escapatória ou seja foi um xeque-mate"
Passar a mão," No caminho fingiu passar mal e quando ela se agachou para ajudar ele, ele a pegou pelo pescoço e a jogou no beco escuro e sem movimento nem um, passando as mãos em seu corpo e tudo mais, tentou rasgar sua roupa so conseguia rasga sua camiseta e sutia, ele queria estrupar ela primeiro pra depois morder ela Ele por ser mais forte rasgou sua roupa por completo passou a mão em sua vagina e violentamente deitou ela a força e queria estrupar ela de qualquer forma Porem por ali estava passando um caçador de vampiros e percebeu algo errado no beco"
Passar a mão,"Xxxx:Luan?-ele olha e vê uma moçaLuan:sou eu-diz estranhandoXxxx:sou a Rose fui eu q falei cm vc no telefoneLuan:oi Rose ,como ta a (seu nome)?-diz preocupadoRose:agora ta melhor mais por pouco ela não perde o bebê-ele a olha sem entenderLuan:bebê? Ela ta gravida?-diz sem entenderRose:sim ta gravida de 1 semana e meiaLuan:1 semana?-diz lembrando da noite q fizeram amor-posso ver ela?Rose:claro venha comigo-diz andando e Luan a segue quando chega na poeta do quarto-so não a deixe nervosa ta? Ela precisa se acalma ta meio perdida, ta vendo aqueles papeis q ta cm ela?-Luan olha de longe e concorda cm a cabeça-ela não quis desgruda daquiloLuan:ta bom obrigada Rose vou fala cm elaRose:de nada-ela sai e Luan entra no quarto ele te vê cm o rosto virado sem piscar vc nem percebe ele entrandoLuan:nega?-vc não responde e continua cm o rosto virado pra parede-nega?-diz chegando perto de vc e passa a mão no seu cabelo vc se assusta e olha pra eleVocê:Luan? Pensei q não vinha-diz fraca pois tava tomando soro e ele tava te dando muito sonoLuan:logico q vinha princesa não ia te deixa sozinhaVocê: Luan eu"
Passar a mão," Mellany: Eu preciso que você fique sentando  Austin: Deitado é melhor  Mellany: Sem viadagem, anda senta logo Austin: Vai mandar agora?- Falou ele sentando na cama Mellany: Agora é eu que to no comando querido- Sorri pra ele, Coloquei a música ""justin bieber all that matters"" e assim que começou a música me virei de costas para ele empinando a bunda e comecei a passar a mão em meu corpo, me virei de frente para ele vendo que ele estava prestando atenção em todos meus movimentos, me aproximei dele fui descendo até o chão lentamente enquanto continuava a passar a mao em meu corpo, seus olhos acompanhava cada passo que eu dava seu sorriso descarado estava lá presente, me aproximei mais dele deixando agora nenhuma distância nos atrapalhar, me virei de costas e fui rebolando até sentar no colo dele, comecei a rebolar mais rápido até senti sua mão em minha cintura, peguei suas mãos tirando elas de minha cintura e guiei ela até meus seios, e quando eu dei a Total liberdade a ele, e vi que ele já estava apertando meus seios por conta própria tirei minhas mao de cima da dele e coloquei elas pousadas em sua perna o que me deu mais força para continuar ""dançando"" em seu colo a música era perfeita para aquele momento a batida perfeita, fazia o clima ficar mais quente mais desejável, sua respiração quente batia em meu pescoço fazendo eu me arrepia Austin: Mellany eu não aguento mais"
