Abaixar a cabeça,"-ele te olha-eu já te vi-ele continua te olhando-eu te conheço-ele pensa um pouco-do cinema ne?Você:sim peço desculpa por ter trombado em vc e na sua namorada e peço perdão pelo meu namo-diz envergonhada e abaixa a cabeçaLuan:não precisa pedi desculpa, eu q tenho q pedi fui um grosso cm vc e minha namo tambem-diz te olhando e Mari chegaMari:aki filho-diz entregando o remédio pra Luan Luan:obrigada mamuscaBruna:bom dia-diz descendo o último degrau- e ai pinguço ta cm dor de cabeça?-diz rindoLuan:toBruna:bm feito-ela ri-olha temos visita qm é?Mari:a nova babá (seu nome) essa é Bruna minha filha tambémVocê: prazer-diz sorrindoBruna: prazer Oiá q babá bonita-diz sorrindoVocê: obrigada-sorri envergonhadaNick:PAPAIIII-grita descendo as escadasBreno:NICK EU Q VOU FALA PARA VAI-grita correndo atrás delaLuan;parem de grita crianças-fala bravoBruna:deixa eles Luan-fala brava tambémMari: ei parem de corre na escada vão cair amors-diz sorrindoNick: noxa q moça munita qm é?-diz sorrindo e parando na sua frenteBreno:bonita memo-diz rindo Você: olá sou a (seu nome) e vou cuida de vcs-vc sorriLuan:oq vcs qriam?-diz serioNick:papai eu e o"
Abaixar a cabeça,"Você:senhor Luan? Ta tudo bm?-pergunta baixinho e ele te olha e pela luz do abajur vc viu q ele estava chorando pois haviam lagrimas em seu rostoLuan:ta,me deixa sozinho pfv-diz frio e abaixa a cabeça vc se aproximaVocê:pq ta chorando senhor Luan? Posso ajuda?-vc se senta do lado deleLuan:já disse pra me deixa sozinho!-diz bravo e em um tom altoVocê:desculpa fiquei preocupada só isso-diz sem jeito e um silencio toma conta-então eu vou deixa"
Abaixar a cabeça,Ele se aproxima e te beija suave e cm muito carinho vcs ouvem os passos de Barbara saindo dali e bate a porta cm força vcs continuam o beijo por mais alguns segundos e param cm um selinho vcs se olham e Luan sorri Luan:obrigado-ele sorri ainda colado em vcVocê:só não qria te ver sofrendo de novo-vc abaixa a cabeçaLuan:e não vou sofre a graças a vc obrigado-ele te faz ergue a cabeça e te olha nos olhosVocê:não precisa agradecer-vc diz meio triste e força um sorrido de canto alguem bate na portaXxxx:TA NA HORA LUAN-grita do lado de foraLuan:JA TO INDO-ele te da um selinho e te solta-vou lá tchau-sorri correndo ate a portaVocê:tchau bom show-vc sorri de canto #SeuPensamentoOn Oq to fazendo? To me apaixonando mais e mais por ele e não posso! Não posso! Não aguento mais essa situação não é certo tenho q fala cm Beto#SeuPensamentoOff Vc enxuga as lagrimas q estavam em seu rosto e vai ver o show vc chorou em algumas músicas pois eram lindas dps de um tempo o show termina mais vc continua sentada onde estava como se estivesse paralisada
Abaixar a cabeça,"Luan:é sim vc é perfeita-Luan então percebe q vc estava chorando baixinho ele se afasta um pouco pra ver seu rosto e vc o braça forte escondendo o rosto vc chora de soluçar-q foi nega? Pq ta chorando?-vc se afasta e coloca sua roupa Luan coloca a cueca e te olhaVocê:nada Luan, nada deixa pra lá melhor eu ir-vc diz chorando e indo pra porta mais Luan segura seu braçoLuan:não vai sai daqui chorando assim não oq foi? Oq ce tm? Fiz algo errado?-te olha sem entenderVocê:não Luan, não é vc sou eu-vc diz abaixando a cabeça e deixando as lagrimas cairemLuan:toda mulher fala isso quando o homem fez algo errado me fala oq eu fiz?-diz meio tristeVocê:eu juro não é vc sou eu, vc é perfeito-vc continua chorando e passa a mao no rosto de Luan Luan: então oq foi?-ele segura sua mãoVocê:já chega eu não aguento mais-vc desabafa e chora mais aindaLuan:não aguenta mais oq?-ele passa a mao em seu rosto sem entenderVocê:Luan eu"
Abaixar a cabeça," Você:de novo isso?-diz pra si mesma-xo acorda ele-vc vai ate Luan-Luan? Luan? Vai dormi na sua camaLuan:me deixa em paz qro dormi q saco-diz cm voz de bêbado-e pra vc é ""SENHORRR"" Luan! -vc engole em secoVocê:aff ta chato hj hein? Vou busca as crianças q eu ganho mais-vc sai chama o motorista q Luan havia contratado pra vc sai cm as crianças vc vai ate a casa de dona Mari vc toca a campainha e logo Bruna te atende-oi Bruh-vc da um beijo no rosto delaBruna:oi (seu apelido)-ela da espaço vc entra e comprimento dona MariVocê: cadê as crianças?-diz forçando um sorriso Mari:ah mai já veio busca elas?-diz meio tristeVocê:já sim-vc sorri de cantoMari:vou chama elas então perai-ela sobe vc olha pra BrunaBruna:q foi?-diz te olhandoVoce; q foi oq?-vc riBruna:ta cm cara de triste-vc abaixa a cabeçaVocê:nada deixa pra lá-quando Bruna ia fala algo vcs escutam a voz de BrenoBreno:titia (seu apelido) tava cm sadade-ele te abraça Você: também tava meu amor-diz quase chorandoNick:Oi titia-ela te abraça-vamo nu paiquinho?-diz sorrindoVocê:nossa mais vcs vivem no parquinho hein? -vc riNick:ah titia pu favoi?-faz biquinhoVocê:vamo sim então dêem tchau pra tia e pra vovó-vcs dão tchau e vcs saem chegando no parque as crianças vão brincar e vc fica sentada olhando vc deixa umas lagrimas caírem mais logo as enxugam ate q alguem senta do seu lado"
Abaixar a cabeça,"eu prometo q volto pra vc-vc diz tristeBeto:então daqui a uns dias te darei todas as informações tchau beijos amor-vc engole em secoVocê:tchau Beto-vc desliga #LigaçãoOff Luan:e ai?-ele te olha ansiosoVocê:tudo resolvido ele vai descobri tudo pra vc-vc força um sorrisoLuan: e qm é Beto?-diz curiosoVocê:meu ex-vc diz triste e abaixa a cabeçaLuan:quantos ele vai qrer por isso? Quantos vai me custa?-vc o olha sem acredita em suas palavras #SeuPensamentoOn Ele só fala de dinheiro? Não custara nada a vc Luan, somente a mim custara a minha felicidade!  #SeuPensamentoOff Você:não se preocupe pra vc não vai custar nada eu irei pagar-diz triste e se levanta ficando de costa pra LuanLuan:como vai pagar? Vc não tm dinheiro pra nada q eu saiba-diz irônicoVocê: não vou pagar cm dinheiro Luan as pessoas não vivem só de dinheiro-vc diz bravaLuan:e pagara como?-vc fica em silencio e deixa as lagrimas caírem e ele te puxa pelo braço te fazendo olha-lo-como vai paga? Não me diga q"
Abaixar a cabeça,-vc é interrompida pela voz de LuanLuan:vcs qrem q ela chamem vcs de filhos é?-vc se assusta e olha pra trásBreno:eu qria-diz triste e abaixa a cabeçaNick:eu tamem quelia-deixa uma lagrima cair e Luan se aproxima estende a mao pra vc e vc se levanta pegando na mao deleLuan:eu posso resolve isso pra vcs-diz sorrindo e vc o olha sem entende-é só fala pra mamãe aceita se casar comigo-ele te olha nos olhos Breno:mamãe pfv assim vc vai ser minha mãe de vdd-diz sorrindoNick:é mamãe pu favoi-diz ficando de pé e segurando sua perna vc sorriLuan:e então cê aceita casa comigo?Você: é serio?-vc sorri sem acreditaLuan:mais serio q isso impossivel-diz sorrindo e colocando seu cabelo atrás da orelha-aceita?-diz se aproximando de seus lábiosVocê: aceito claro-diz sorrindo e ele te beijaBreno:ebaaa-sorri e vcs param o beijo pra olha-losNick:e oq ce quelia faia mamãe?-diz animadaVocê: ah filha nada deixa pra la-vc sorriLuan:nada também não ne?-diz te olhando e vc não entende-vc tm algo pra conta pra eles sim lembra?-vc então lembra da gravidezBreno:oq é mamãe?-diz ficando de péVocê:filho é q vcs vão ter um irmão ou irmã num sei ainda-vc sorri Breno:ebaaa tomara q seja homem pra eu joga futebol cm ele-vcs dão risadaNick:não tomara q seja menina pra brinca de boneca comigo-vcs ficam lá abraçados e rindo das crianças
Abaixar a cabeça," Alex: Não pense em falar isso- Me calei abaixando a cabeça Carlos: Não esqueça Mellany que Alex é o mais rico daqui, ele pode te usar a qualquer hora, assim como eu posso te lembrar de como é ruim não respeitar as regras  Mellany: Eu não sou uma camisinha pra ser usada Carlos: Você é pior do que uma camisinha, você é uma vadia- Falou tirando uma chave de seus bolso e entregado a Alex Carlos: Boa sorte"
Abaixar a cabeça,"ele terminou de se vestir e ia saindo me levantei parando no meio do quarto  Mellany: Você volta?- Olhei pra ele com medo de sua resposta ser um não,Ele abaixou a cabeça e deu um sorriso cafajeste e caminhou até o meio do quarto parando em frente pra mim, sua mão foi até minha nuca me puxando para ele, deixando pouco centímetros de distância, ele sorriu e me puxou para um beijo com pegada, apertando minha bunda o beijo era selvagem tinha desejo tinha tudo naquele beijo mais logo foi parado pela falta de ar  Austin: Isso responde sua pergunta? Mellany: Prefiro ouvir da sua boca- Sussurrei em seu ouvido Austin: Sim Mellany eu volto- Ele falou isso e se afastou de mim, saindo do quarto, assim que ele saiu me joguei na cama com um sorriso de orelha a orelha, nem eu mesma sabia o porque está daquele jeito, eu sentia que podia confiar nele, sentia que podia contar com ele sempre e sabia de uma coisa Continua?"
Abaixar a cabeça,"Você não gosta mais de mim? Você conheceu outra garota?- Ela continuou fazendo perguntas Austin: É claro que eu gosto de você  Emma: Dias atrás você iria dizer que me amava e não só que gostava  Austin: Emma por favor não vamos brigar de novo  Emma: Tudo bem- Ela abaixou a cabeça, levei minha mão até seu rosto e alisei ele, ela levantou seu olhar e me puxou para um beijo logo subindo em cima de mim"
Abaixar a cabeça," - ele me olha e eu abaixo a cabeça para não olhar em seus olhos  - E você tem alguma suspeita? A corredora?  - Não, quer dizer passou essa hipótese, mas não ela deve ter algum ajudante, alguém que conte tudo para ela, seu braço direito"
Abaixar a cabeça,"  - Priscila apenas cale a boca, não me interessa o que eu signifiquei para você porque pra mim você não foi nada - Ela se encolhe e abaixa a cabeça  Olho para o lado e vejo uma menina de óculos empurrando um carrinho com diversos livros"
Abaixar a cabeça,"  - Esmeralda eu vivi minha vida toda assim e não vai ser você que vai me mudar, VAI EMBORA AGORA!! - eu grito e ela se assusta  Ela abaixa a cabeça derrotada e começa a andar de volta para casa, olho para sua jaqueta que possui o simbolo de Ouroboros  - Ei aonde conseguiu essa jaqueta?! - Corro até ela e puxo seu braço"
Abaixar a cabeça," — Não me peça calma, não é seus irmãos que estão naquela sala por incompetência sua, não me peça calma se não sabe a sensação de estar perdendo uma grande parte sua — Ele me olha e abaixa a cabeça  Sei que estou sendo malvado, mas eram meus irmãos que estavam presos em salas naquele maldito hospital"
Abaixar a cabeça,"  -É, eu to!- Ela abaixa a cabeça  -Eu imagino o que você tenha passado lá, ou melhor, eu não imagino"
Abaixar a cabeça," Foi como sentir a brisa do sol quando estar quase congelando ,muito bom kkkk-- park jimin kkk vc e bem gelado - abaixo a cabeça e tae levanta ela com seu dedo  --nunca abaixe a cabeça , sempre com ela erguida jimin - ele fala com um sorriso no rosto me encarando ,logo lembrei oq minha mãe me disse , foi a mesma coisa "
Abaixar a cabeça," -Como assim pergunta a Jonh? - falo meio confusa Então me virei e vi Jonh descer as escadas todo arrumado com uma mala e uma passagem na mão, assim que ele me viu abaixou a cabeça e veio falar comigo - Samh eu"
Abaixar a cabeça," - Nossa Samh! E seu pai, Cadê? -Pergunta ele - Não sei nunca o vi, nunca me importei! - abaixo a cabeça - É"
Abaixar a cabeça," Você sabe que falo isso pro seu bem! - Diz ele com um sorriso de canto Fiquei sem oque dizer na hora, apenas abaixei a cabeça e concordei com o seu questionamento Assim que levantei a cabeça e olhei pra o lado, vi Caio na porta nos observando meu coração até gelou, não sei o por que mas a cara que Caio fez não foi das melhores"
Abaixar a cabeça,"  Então me arrumei e fui para a faculdade e já que estudavamos na mesma instituição eu aproveitaria pra dá um fim na nossa história, porém por incrível que pareça ele não tinha ido naquele dia \ Me sentei num banco e abaixei a cabeça, veio vários pensamentos de dúvidas na minha mente até pensei que iria enlouquecer, parecia que tudo na minha vida dava errado, todas as escolhas que eu fazia era errado não aguetei a pressão abixei a cabeça e chorei  -🎶🎶Porque Eu te ameiUma cruz pesada carregueiPorque Eu te ameiA morte Eu também enfrenteiPorque Eu te ameiMesmo sem você me amarPorque Eu quero te salvar meu filho"
Abaixar a cabeça," - É verdade com certeza Deus quer e vai falar com você hoje! - Diz Melissa olhando pra mim - Obrigado Gente, na verdade eu vim pra tentar uma nova vida, sabe eu não aguento mais tudo o que se passa comigo! - Digo abaixando a cabeça - Que bom que decidiu mudar de vida, fico muito feliz por você e se quiser eu peço ao nosso pastor para orar por você no final do culto! - Diz Marcos segurando minha mão"
Abaixar a cabeça," E tudo mais naquela igreja, mas aquilo tudo foi por emoção por eu está triste naquele momento, quer saber de uma coisa Deus não existe e ponto final!\- Diz ela aos gritos, subindo as escadas em direção ao seu quarto Depois que Samantha subiu para o seu quarto deixando assim eu sozinho na sala, aproveitei o momento e me ajolhei no sofá para orar por ela, e pedir a Deus Sabedoria para le da com toda aquela situação, então me ajoelhei abaixei a cabeça e orei assim: \ O espirito santo de Deus vai ser difícil pra mim me ajude, me dê sabedoria, me dê palavras para direcionar a ela pois não sei mais oque dizer, não sei mais oque fazer O espírito santo interceda a Deus por ela ajude ela a achar o caminho certo e não permitas que mais tragédias ocorra na vida dela, a não ser que tenhas um propósito pois tu és o Deus que complica, Descomplica e depois explica porquê complicou, então Pai, faz com ela o que fizeste comigo que apesar de tudo me fizeste Vencedor, e que seja assim com ela, em nome de Jesus Amém! - É isso, é exatamente isso o meu testumnho vai ajuda-lá a vencer nessa vida, O meu Deus eu te amo obrigado, obrigado por ter abrido minha mente para oque fazer com ela"
Abaixar a cabeça, Ele se foi! - Diz o enfermeiro abaixando a cabeça e tirando as luvas de suas mãos - Não! não meu Deus por que? Por que? - Grito e caio de joelhos no chão
Abaixar a cabeça,"\\ -Daddy,sabe que eu fico com vergonha quando me encara!-ela diz,tampando seu rosto\\ Cellbit prende a mesma contra a parede\\ -Você sabe que eu não gosto quando se veste assim!Agora ele acordou,e você vai ter que resolver isso!-diz Lange,a encarando\\ S/N abaixa a cabeça,mas Rafael a pega no colo,fazendo ela olhar pra ele\\ -Agora você será castigada!Vai ter que me encarar,enquanto eu te como bem devagar!-ele diz,a encarando-Se não me obedecer,você será castigada de uma forma bem pior,e eu não quero que isso aconteça!\\ Rafael leva S/N em direção ao sofá e lá começa a despir a mais nova"
Abaixar a cabeça,"Lisa sabia que S/N tinha uma queda por seu irmão,mas pensou que isso era passageiroQuando Rafael está prestes a sair do quarto,ele olha para a tela do notebook de Lisa e pisca para S/N,que sorri e abaixa a cabeça\\ -S/N!Isso que eu vi,foi meu irmão\ flertando com você?! RaS/N vindo por aí!-Lisa diz dando risada\\ -Cala a boca Lisa!-S/N diz corada\\ Então,após a chamada,S/N guarda o Notebook e desce para fazer algo para ela comer"
Abaixar a cabeça," Ele se senta em um banco, no canto e eu no outro banco, de frente pra ele Yoongi abaixa a cabeça e começa a brincar com os dedos - Yoongi, por que você está me evitando? - Pergunto triste"
Abaixar a cabeça," - Jungkook, eu acho, abaixou a cabeça e segurou as lágrimas - Taehyung"
Abaixar a cabeça," \ \ \\ - Por favor, alguém me ajuda- falo sem fôlego \ \ \\ Coloco as mãos no joelho e abaixo a cabeça para tentar respirar  \ \ \\ - Alguém"
Abaixar a cabeça,sempre- falo sincera \ \ \- Sei- ele abaixa a cabeça e limpa a garganta- tenho que voltar para o trabalho \ \ \- A gente se vê por ai- beijo seu rosto enquanto ele me abraça de lado
Abaixar a cabeça,"especial na minha bolsa Eu não queria perder  - E você achou que valia a sua vida? - Meera questionou, ainda gradualmente superando o medo de perder o irmão, especialmente por algo tão trivial quanto uma bugiganga perdida  Ele abaixou a cabeça, parecendo irritado e frustrado, uma expressão imcomum para o garoto que você amava  - Um anel  Você percebeu o significado em um instante  - Jojen, você não teve culpa  Ele acenou com o cabeça - não importa Eu deveria ter sido mais cuidadoso - seu tom era desdenhoso, mas ele claramente ainda estava chateado  Meera olhou pra vocês com curiosidade, tendo sido mantida fora do circuito até agora quando ela pereceu que se tratava de seu relacionamento"
Abaixar a cabeça,"Bellatrix lançou um maldição imperdoável\ em Neville e e-eu a matei - digo vendo ele abaixar sua varinha  - Você fez o que? - ele grita  - Eu não quero estar do lado ruim - eu digo vendo ele abaixar a cabeça  - Eu prefiro que seja assim também, mas você sabe"
Abaixar a cabeça, Havia um garoto em particular que prestava mais atenção em você e notava o quanto você ficava tensa cada vez\que Polo estava perto Durante semanas ele apenas observou mais um dia isso tudo mudou  - Sn? Você abaixou a cabeça e correu entre os estudantes segurando seu caderno perto do peito  - Sn! - ele conseguiu alcançá-la e agarrá-la pelo cotovelo  Você o puxou para trás com tanta força que tropeçou e deixou cair\seus livros Você se ajoelhou para pegá-los e ele a ajudou
Abaixar a cabeça," Ele morreria por seu pecado antes de deixar que você morresse em seu pecado, de modo que fez exatamente isso O que você faz com tal Salvador? Você não canta para ele? Não o celebra em batismo, não o exalta na ceia do Senhor? Você não dobra o joelho, abaixa a cabeça, bate um prego, alimenta o pobre e entrega seu dom em adoração? É claro que sim Adore a Deus"
Abaixar a cabeça," ""Essa é uma das minhas músicas favoritas, e acho que ela diz algumas muitas coisas que precisava te falar, além de ser muito linda"" abaixou a cabeça, com as bochechas coradas ""Alguém está chorando e com vergonha? Ah, não acredito!"" Taehyung pulou em cima dele e abraçou seu pescoço"
Abaixar a cabeça,"  Acelero o carro e passo o da minha mãe , de longe ja da pra ver , estaciono e olho para a mansão , vejo uma garota que parecia ser mais nova que eu , também olhando a casa , observo suas roupas e vejo alguns rasgos e me pergunto o que aconteceu , sou tirada dos meus pensamentos quando sinto uma mao no meu ombro  -Filha voce tem certeza -pergunto e respiro fundo tentando controlar minha raiva  -Sim uma hora ou outra vou ter que enfrentar - falo e a mesma suspira  -Você tem razão - fala apenas  Vamos até a porta e minha mãe toca a campanhia , uma senhora abre a porta e da espaço para entramos , observo tudo até que meus olhos batem com a garota que acabei de ver alguns minutos atrás de cabeça baixa  -Filha que bom que vocês chegaram - um cara que suponho ser o tal do Rodrigo aparece na minha frente com um sorriso mais largo do que o do coringpoupe  -Me poupe e me fale logo o que você quer! - falo com rancor e ele fecha a cara  °°°Amor já chegou todo mundo ? - uma mulher aparece atrás com um sorriso tão falso que chega a ser ridículo  °°°Sim ja podemos conversar fernada- fala encarando minha mãe que estar de mao dada com o Pietro - quem é ele ? - antes que minha mãe responda eu tomo a frente  °°°Meu pai - ele me encara e da de ombro  Ele começa a andar em direção ao que acho que seja o escritório e o seguimos , a garota que ainda não descobri o nome vem em minha direção e me abraça, por alguns minutos fico sem reação ate que devolvo o abraço  °°°Você é mais linda pessoalmente prazer me chamo Karol - fala depois de terminar de me abraçar e quando iria responder uma voz incrivelmente fina fala na nossa frente  °°°O que essa mendiga estar fazendo na minha casa , xoo tem pão Velho aqui não - observo a Karol abaixar a cabeça e percebo que ela é uma das minhas irmãs que minha mãe citou antes de vimos para a capital  °°°Filha ela é sua meia irmã - fala a mulher chamada fernanda tentando não rir  °°°Como que é ? ESSA MENDIGA E MINHA IRMA PAI ? - fala é sinto minha paciência indo para a puta que pariu, vejo minha mãe observar a cena abismada  °°°Sim filha -fala e o encaro ele não vai falar nada ?  °°°Não eu não sou irma dessa imunda - fala é vejo os olhos da Karol se encher de água e sai correndo para fora de casa , olho para minha mãe pedindo para que ela vá atrás dela"
Abaixar a cabeça,"\  Antes da aula de Amy terminar eu me levanto e fico esperando  O primeiro a sair é Vinnie, ele me encarou, eu encarei de volta e ele abaixou a cabeça e continuou andando Fingiu totalmente que não me reconheceu"
Abaixar a cabeça," - Falar tudo que sentia por ele ter me traido foi maravilhoso,me sente em paz por minutos,até que ele chorou - Nico abaixa a cabeça - E? Você não"
Abaixar a cabeça,"- Você tá me traindo?- pergunto  - Sim, eu tô- ele fala e abaixa a cabeça - Você sabe que eu quero terminar, então eu tô terminando"
Abaixar a cabeça, ー O seu amiguinho estava quase comendo a babá ー Eu disse em um tom enojado e Louis abaixou a cabeça fitando o chão ー Desculpa
Abaixar a cabeça," ー Eu estou tão chateada quanto você, Jack ー Ele abaixou a cabeça e vi lágrimas escorrendo por seu rosto, um nó se formou em minha garganta também ー O que as pessoas vão achar ao ver nós dois chorando? ー Falei e ergui sua cabeça, fiz ele olhar diretamente para mim"
Abaixar a cabeça," Isso para mim não sigficou nada assim como você não é nada para além de uma pressa para mim Eu digo friamente e vou embora, ela abaixou a cabeça e pude perceber que ela coloca a mão nos lábios e não sei porque, mas eu senti um enorme vontade de voltar, porém não o fiz e segui meu caminho para fora da li a deixando só"
Abaixar a cabeça," O resto eu me resolvo depois Todos abaixam a cabeça afinal todos ali eram mas velhos levando bronca de uma menininha de 14 anos Autora- Bom, olá meus amores, bem vindos ao primeiro perguntas e respostas, eu recebi muitas perguntas nas quais nossos personagens vão responder"
Abaixar a cabeça," Percy - Grover!!! Atras de você! Ele desviou rolando para o lado me dando tempo de contra-atacar com um corte em seu ombro seguido de um chute no peito do semideus que tentava nos atacarGrover - O que vamos fazer? Ele abaixava a cabeça para desviar de vários golpesPercy - Ok, vamos até a bandeira! Saímos em disparada para o centro da arena, bloqueava as espadadas de todos, enquanto Grover derrubava todos na força bruta"
Abrir a boca,"""Ela é um poço de qualidade e defeito"" Boa leitura🍂📖 1 Mês já havia se passado,e depois daquele meu último sonho com Angel eu nunca mais sonhei com ela, contei para Austin sobre Angel, na verdade não contei a verdade, quem era Angel, não contei que em meus sonhos ela era nossa filha, e falar em filha eu não contei ainda para ele sobre eu estar grávida, mas decidi que hoje seria um ótimo dia para contar para ele, estamos um pouco afastados, depois aconteceu alguns beijos mais apenas isso, ele estava começando a se afastar e aquilo estava me deixando um pouco mal, Já era a noite e no relógio marcava raramente 20 horas tomei um banho e coloquei um short e uma blusinha onde já era visível um pequeno volume em minha barriga Desci as escadas e estava quase na hora dele chegar do trabalho e agora sempre tenho certeza que ele voltaria, pois agora ele está morando aqui e por poucas vezes me esbarrei com Emma e dava glória deus a isso,  Terminei de passar meu perfume e desci aquelas escadas que de dias em dias parecia está ficando maior, fui até a cozinha onde Claudia estava lá conversando com a empregada  Mellany: Nossa que cheiro bom- Falei assim que entrei na cozinha chamando atenção delas Claudia: Gostou, Austin pediu para fazermos um jantar bom, pois ele tem algo a dizer hoje  Mellany: Sabe o que ele tem a dizer?Claudia: Não e eu estou tão curiosa quanto você Mellany: Não estou curiosa Claudia: Sei- Disse arqueando sua sobrancelha Mellany: Estou com fome- Logo peguei uma maçã dando uma mordida onde ela parecia tão saborosaClaudia: Rita você percebeu que depois que dona Mellany veio morar aqui ela está dando uma engordadinha- Clau disse à Rita a empregada, logo me fazendo engasgar com a minha maçã Mellany: Ta me chamando de gorda dona Claudia Dawson- Brinquei com elaMas assim que ela abriu a boca para falar escutamos o barulho da porta e logo senti meu coração pular para fora, sabia exatamente que era ele Deixei minha maçã de lado e fui dando passos devagar até chegar na sala onde ali ele estava mais algo que eu vi fez meu coração por um minuto parar de bater e praticamente um soco acertar em cheio em meu rosto  Ele estava encostado no sofá e beijando ela, ela logo ela, suas mãos estavam na cintura dela a boca dele estava colada na dela, ele estava com ela"
